"","edge_liked_by.count","tags","Date","timestamp","Year"
"1",1908,"['pnwisbeautiful', 'stunnersoninsta', 'omht', 'ourplanetdaily', 'traveloregon', 'exploreoregon', 'oregonnw', 'pnw', 'jj_oregon', 'longexposure_shots', 'bestoforegon', 'beautifuldestinations', 'usinterior', 'pnwdiscovered', 'earth_shotz', 'pnw_compass', 'earthfocus', 'pnwparadise', 'artofvisuals', 'longexposure', 'nationalparkgeek', 'oregon', 'earthpix', 'ig_color', 'fallcolors', 'pnwonderland', 'oregonexplored', 'sunset', 'cascadiaexplored', 'pnwcollective']","3/9/19",2019-03-08 16:58:10,"2019"
"2",684,"['visualambassadors', 'optoutside', 'smithrockstatepark', 'ThisisBend', 'traveloregon', 'smithrock', 'oregonnw', 'fiftyshadesofnature', 'staypnw', 'pnw', 'northwestcreatives', 'upperleftusa', 'backyardbend', 'sonorthwest', 'awesome_earthpix', 'pnwcrew', 'northwestisbest', 'landscapephotographer', 'natgeoyourshot', 'bendoregon', 'wildernessculture', 'theimaged', 'thegreatpnw', 'choosemountains', 'westbysouthwest', 'exploremore', 'splendid_shotz', 'westcoastbestcoast', 'winter']","3/4/19",2019-03-04 15:41:16,"2019"
"3",580,"['explore_countryside', 'outinoregon', 'landscape_lover', 'smithrockstatepark', 'gottalove_a', 'pnwphotographer', 'traveloregon', 'fiftyshadesofnature', 'jj_oregon', 'ig_captured', 'upperleftusa', 'pnwisbest', 'bestoforegon', 'nature_brilliance', 'traveltuesday', 'ig_landscapes', 'pnwparadise', 'bendoregon', 'pdxlife', 'ipulledoverforthis', 'wonderfuloregon', 'nofilterneededforthisbeauty', 'bns_nature', 'pnwonderland', 'wonderful_location', 'hey_ihadtosnapthat', 'splendid_nature']","2/13/19",2019-02-12 18:01:25,"2019"
"4",478,"['explororegon', 'onlocation', '1859oregon', 'smithrockstatepark', '1859magazine', 'traveloregon', 'nwoutdoors', 'bestoforegon', 'productionlife', 'dougonlocation', 'locationmanager', 'oregonoutdoors', 'oregonlocationmanager', 'oregonlocationscout', 'cascadia', 'preproduction', 'locationscout', 'locationscouting', 'bestofthenorthwest', 'filmoregon', 'filmproduction', 'centraloregon', 'lifeontheroad']","2/6/19",2019-02-06 09:07:11,"2019"
"5",529,"['optoutside', 'hiking', 'thatpnwlife', 'traveloregon', 'exploreoregon', 'mountain', 'wilderness', 'outdoors', 'herpnw', 'pnw', 'upperleftusa', 'outside', 'mountainlife', 'hike', 'exploregon', 'oregon', 'scenery', 'herpnwlife', 'getoutside', 'oregonexplored', 'landscapes']","1/26/19",2019-01-26 15:55:15,"2019"
"6",340,"['bestofnorthwest', 'pnwisbeautiful', 'northwest', 'wishyouwerenorthwest', 'thenwadventure', 'traveloregon', 'smithrock', 'oregonnw', 'pnw', 'Oregon', 'upperleftusa', 'bestoforegon', 'visitpnw', 'northwestisbest', 'cascadia', 'bendoregon', 'olympuscamera', 'thatPNWlife', 'pacificnorthwest', 'pnwonderland', 'oregonexplored', 'cascadiaexplored', 'pnwcollective']","1/1/19",2019-01-01 13:27:51,"2019"
"7",586,"['optoutside', 'roamersworld', 'onlyinoregon', 'getoutstayout', 'smithrockstatepark', 'thebestofbend', 'visitcentraloregon', 'thatpnwlife', 'traveloregon', 'discoveramerica', 'pnwroamers', 'upperleftusa', 'bestoforegon', 'pnwdiscovered', 'youroregon', 'thegreatoutdoors', 'stayandwander', 'bendoregon', 'visitbend', 'conquerOregon', 'usaprimeshot', 'choosemountains', 'pnwonderland', 'livetravelchannel', 'rei1440project', 'oregonexplored', 'oregonlandscapes', 'outdoors_society', 'cascadiaexplored', 'pnwcollective']","11/14/18",2018-11-14 12:51:38,"2018"
"8",395,"['solotravel', 'optoutside', 'gapyear', 'keepitpublic', 'theoutbound', 'campvibes', 'ourplanetdaily', 'visitcentraloregon', 'traveloregon', 'smithrock', 'CascadiaExplored', 'finditliveit', 'pnwisbest', 'traveldeeper', 'keepexploring', 'northwestisbest', 'goneoutdoors', 'stayandwander', 'artofvisuals', 'adventureculture', 'visitbend', 'adventuretravel', 'keepitwild', 'adventurethatislife', 'fulltimetravel', 'rei1440project', 'oregonexplored', 'solotraveler', 'nomadlife']","11/12/18",2018-11-12 14:01:14,"2018"
"9",547,"['votingday', 'optoutside', 'kidstagram', 'hiking', 'downbytheriver', 'VisitBend', 'SmithRock', 'outdoors', 'TravelOregon', 'Redmons', 'VOTEVOTEVOTE', 'nature', 'lgbtfamily', 'VisitOregon', 'hikers', 'CentralOregon', 'IVoted', 'liveoutdoors', 'Bend', 'gaydads', 'StatePark', 'SevenWondersofOregon']","11/6/18",2018-11-06 06:48:01,"2018"
"10",585,"['optoutside', 'gayfamily', 'guysthattravel', 'bffs', 'VisitBend', 'rockformation', 'Terrabonne', 'MiseryRidge', 'SmithRock', 'familytravel', 'travelgram', 'Oregon', 'TravelOregon', 'OregonParks', 'travelblog', 'family', 'selfie', 'LGBTfamily', 'CrookedRiver', 'Bend', 'rockclimbers', 'dudes', 'gaydads', 'gaydad', 'statepark', 'SevenWondersofOregon']","11/5/18",2018-11-05 08:01:34,"2018"
"11",1010,"['traveltime', 'bestplacetogo', 'tripstagram', 'travelingtheworld', 'smithrockstatepark', 'traveladdicted', 'loveusa', 'travelworld', 'usatravel', 'discoverusa', 'traveloregon', 'exploreoregon', 'smithrock', 'bestplace', 'travelphotos', 'highdesert', 'discovertheworld', 'travelnow', 'visitusa', 'iloveusa', 'travelandleisure', 'bestplaceever', 'bestplacestogo', 'travelstroke', 'ig_usa', 'oregonexplored', 'travellove', 'usatrip', 'travellover', 'exploreusa']","10/29/18",2018-10-29 06:12:24,"2018"
"12",950,"['randallpics', 'hiking', 'camping', 'traveloregon', 'exploreoregon', 'adventure', 'smithrock', 'outdoors', 'pnw', 'fineartphotography', 'upperleftusa', 'landscapephotography', 'singhrayfilters', 'reallyrightstuff', 'northwestisbest', 'photography', 'pacificwonderland', 'landscapephotomag', 'adobe', 'bestofpnw', 'tamronlenses', 'nikonUSA', 'pacificnorthwest', 'oregon', 'terrabonn_eoregon', 'pro_ig', 'pnwonderland', 'oregonexplored', 'centraloregon']","10/12/18",2018-10-11 19:18:26,"2018"
"13",359,"['travelportland', 'optoutside', 'roadtrip', 'exploretocreate', 'discoverwashington', 'wearestillwild', 'thenwadventure', 'campvibes', 'ourplanetdaily', 'traveloregon', 'pnw', 'upperleftusa', 'pnwdiscovered', 'rei', 'ourcamplife', 'wildernessculture', 'vanlife', 'naturallight', 'thegreatpnw', 'pnwonderland', 'adventurethatislife', 'neverstopexploring', 'oregonexplored', 'cascadiaexplored']","10/9/18",2018-10-09 13:00:13,"2018"
"14",1356,"['womenintech', 'liketkit', 'traveloregon', 'oregonblogger', 'LTKstyletip', 'LTKunder50', 'LTKunder100', 'pdxblogger', 'portlandblogger', 'womenintechnology', 'swooshlife', 'thealieffect', 'LTKsalealert', 'smithrockstatepark', 'LTKshoecrush', 'nike', 'oregonadventures']","8/28/18",2018-08-27 21:50:49,"2018"
"15",1478,"['pnwisbeautiful', 'pnw', 'nw', 'travel', 'adventure', 'traveloregon', 'oregon']","8/26/18",2018-08-25 20:38:48,"2018"
"16",1119,"['nikonphotography', 'exploretocreate', 'landscape_lover', 'naturephotography', 'd850', 'thebestofbend', 'traveloregon', 'smithrock', 'BestOfOregon', 'mountainview', 'hoyafilterusa', 'landscapephotography', 'nationalparks', 'earth_shotz', 'losangelesphotographer', 'ShotzDelight', 'lonelyplanet', '52weeksofnature', 'Oregonexplored', 'PNWparadise', 'oregon', 'exploremore', 'natgeotravel']","7/29/18",2018-07-29 12:22:38,"2018"
"17",702,"['travelportland', 'thatoregonlife', 'royalsnappingartists', 'moodygrams', 'bestofbend', 'waterfallwednesday', 'thatpnwlife', 'traveloregon', 'smithrock', 'oregonnw', 'jj_oregon', 'pnw', 'longexposure_shots', 'pnwdiscovered', 'mastergallery', 'youroregon', 'earthfocus', 'pnwcompass', 'theimaged', 'oregon', 'ig_color', 'pnwonderland', 'oregonexplored', 'centraloregon', 'cascadiaexplored', 'waterfallsfordays']","7/18/18",2018-07-18 06:43:41,"2018"
"18",424,"['oregonlife', 'alphacollective', 'folkgood', 'bendoregon', 'folkscenery', 'exploretocreate', 'rockclimbing', 'oregoncoast', 'oregonexplored', 'oregonhikes', 'smithrockstatepark', 'sonyalpha', 'watchthisinstagood', 'liveoutdoors', 'traveloregon', 'oregon']","7/4/18",2018-07-04 07:13:43,"2018"
"19",406,"['travelgram', 'optoutside', 'pnwonderland', 'adventurecouple', 'oregonexplored', 'smithrockstatepark', 'veganfortheplanet', 'pacificnorthwest', 'traveloregon']","7/4/18",2018-07-03 19:33:01,"2018"
"20",489,"['traveloregon', 'lesbiancouple', 'optoutside', 'pride', 'herpnwlife', 'lgbtqpride', 'lovewins', 'oregonexplored', 'smithrockstatepark', 'adventure', 'vegancouple', 'instagay', 'pacificnorthwest', 'hikeoregon']","6/26/18",2018-06-26 12:06:53,"2018"
"21",423,"['traveloregon', 'bendoregon', 'oregon', 'smithrockstatepark', 'climbing', 'smithrock']","6/26/18",2018-06-25 17:21:22,"2018"
"22",463,"['traveloregon', 'instagood', 'myrock', 'hiking', 'travel', 'grateful', 'instalike', 'explore', 'wonderlust', 'spiritualgangster', 'exploreoregon', 'instadaily', 'adventure', 'wanderlust']","6/24/18",2018-06-24 09:37:07,"2018"
"23",329,"['oregonstateparks', 'optoutside', 'oregonexplored', 'hikingadventures', 'smithrockstatepark', 'pacificnorthwest', 'traveloregon', 'smithrock', 'hikeoregon']","6/24/18",2018-06-24 09:36:29,"2018"
"24",535,"['friendshipgoals', 'friendsquad', 'pnwonderland', 'oregonexplored', 'oregonisabovecalifornia', 'smithrockstatepark', 'goodpeople', 'pacificnorthwest', 'traveloregon', 'smithrock', 'hikeoregon']","6/24/18",2018-06-23 23:07:46,"2018"
"25",1225,"['adventureoften', 'loveislove', 'pnwonderland', 'lgbtqpride', 'lovewhoyoulove', 'oregonexplored', 'lgbtq', 'smithrockstatepark', 'traveloregon', 'smithrock', 'livealifeyoulove']","6/24/18",2018-06-23 22:03:44,"2018"
"26",2377,"['pnwisbeautiful', 'mtnchicks', 'optoutside', 'wildernessnation', 'thatpnwlife', 'traveloregon', 'likeamountaingirl', 'JUCYxOR', 'pnw', 'jucyusa', 'upperleftusa', 'mtnbabes', 'pnwhikers', 'pnwparadise', 'womenwhohike', 'ourwild', 'wildernessculture', 'pnwbabes', 'savortheadventure', 'hikingtheglobe', 'hikingculture', 'herpnwlife', 'pnwonderland', 'mountainhardwear', 'mountaingirls', 'peoplewhohike', 'werehikers', 'ospreypacks', 'goatworthy']","5/29/18",2018-05-29 09:21:41,"2018"
"27",496,"['roadtrip', 'roadtriporegon', 'rocks', 'wildlifephotography', 'wildwest', 'smithrockstatepark', 'igersusa', 'instatravel', 'traveloregon', 'exploreoregon', 'smithrock', 'travelgram', 'naturelovers', 'natural', 'roadtripusa', 'oregon2018', '7wondersoforegon', 'nature', 'westernmovie', 'bendoregon', 'igtraveller', 'wildwildwest', 'scenery', 'oregonexplored', 'wosinddieapachen']","5/28/18",2018-05-28 10:05:55,"2018"
"28",3919,"['TravelOregon', 'JucyXOR', 'JucyUSA']","5/23/18",2018-05-23 13:29:25,"2018"
"29",577,"['JUCYxOR', 'traveloregon', 'JUCYUSA']","5/23/18",2018-05-22 17:40:28,"2018"
"30",2771,"['pnwisbeautiful', 'mtnchicks', 'wildernessnation', 'thatpnwlife', 'traveloregon', 'likeamountaingirl', 'JUCYxOR', 'pnw', 'jucyusa', 'upperleftusa', 'mtnbabes', 'pnwdiscovered', 'pnwhikers', 'pnwparadise', 'womenwhohike', 'wildernessculture', 'pnwbabes', 'pacificnorthwest', 'hikingtheglobe', 'hikingculture', 'herpnwlife', 'pnwonderland', 'mountainhardwear', 'mountaingirls', 'peoplewhohike', 'werehikers', 'ospreypacks', 'goatworthy']","5/21/18",2018-05-21 09:00:42,"2018"
"31",3986,"['jucyusa', 'traveloregon', 'jucyxor']","5/19/18",2018-05-19 13:15:22,"2018"
"32",477,"['JUCYxOR', 'traveloregon', 'JucyUSA']","5/19/18",2018-05-19 09:01:13,"2018"
"33",461,"['JUCYxOR', 'traveloregon', 'JucyUSA']","5/17/18",2018-05-17 09:00:46,"2018"
"34",530,"['JUCYxOR', 'traveloregon', 'JUCYUSA']","5/16/18",2018-05-15 20:18:45,"2018"
"35",7066,"['TravelOregon', 'JucyxOr', 'JucyUSA']","5/14/18",2018-05-13 17:01:30,"2018"
"36",4252,"['jucyusa', 'JUCYXOR', 'travelOregon']","5/13/18",2018-05-13 12:57:04,"2018"
"37",344,"['pnw', 'goastguardwife', 'lovehim', 'militarywife', 'oregon', 'coastguard', 'smithrockstatepark', 'weekendidos', 'adventure', 'husbandandwife', 'traveloregon', 'smithrock', 'whenheshome']","4/23/18",2018-04-23 11:48:58,"2018"
"38",363,"['mtnchick', 'optoutside', 'girlinflannel', 'mountainsarecalling', 'northwest', 'bestofbend', 'traveloregon', 'smithrock', 'alpinebabe', 'pnw', 'go4theglobe', 'travelgirl', 'bestoforegon', 'lumixg', 'nrthwst', 'realtalk', 'visitoregon', 'travelinladies', 'flannelfriday', 'TGIF', 'oregon', 'fridayfeeling', 'flannel', 'teamflannel', 'pnwonderland', 'travelcouple', 'damestravel']","4/20/18",2018-04-20 09:05:33,"2018"
"39",1021,"['explorebc', 'optoutside', 'adventureisoutthere', 'rockclimbing', 'climbing', 'smithrock', 'traveloregon', 'humanpoweredadventures', 'bestoforegon', 'lifeofadventure', 'climbingisbliss', 'stayandwander', 'adventuretheatislife', 'bendoregon', 'wildernessculture', 'TimetoClimb', 'getolympus', 'visitbend', 'celebratewild', 'theclimbinglife', 'climbingmag', 'pacificnorthwest', 'climbing_pictures_of_instagram', 'climbinginspiration', 'grippedmagazine', 'rei1440project', 'oregonexplored', 'climbing_is_my_passion', 'expandyourplayground']","4/18/18",2018-04-18 07:51:36,"2018"
"40",452,"['optoutside', 'hikinglocations', 'viewfromthetop', 'NWisBest', 'traveloregon', 'adventure', 'SmithRock', 'cliffhanger', 'travelgirlsgo', 'GLT', 'Oregon', 'go4theglobe', 'alpinebabes', 'nature', 'traveltuesday', 'nrthwst', 'lowaboots', 'travelinladies', 'bestofOregon', 'hikingtheglobe', 'visitOregon', 'hikingculture', 'PNWlife', 'travelcouple', 'oregonexplored', 'damestravel', 'herPNWlife']","4/17/18",2018-04-17 11:47:08,"2018"
"41",705,"['pnwisbeautiful', 'thatoregonlife', 'onlyinoregon', 'thenwadventure', 'ourplanetdaily', 'thatpnwlife', 'traveloregon', 'oregonnw', 'staypnw', 'pnw', 'pnwroamers', 'bestoforegon', 'createxploretakeover', 'pnwdiscovered', 'offthechaingram', 'pnwbucketlist', 'pacificallyoregon', 'pnwparadise', 'stayandwander', 'bendoregon', 'pnwgrammers', 'naturaloregon', 'visitbend', 'pacificnorthwest', 'pnwadventuresquad', 'pnwonderland', 'neverstopexploring', 'oregonexplored', 'discovervisuals', 'centraloregon']","4/8/18",2018-04-07 21:20:54,"2018"
"42",350,"['equine', 'nikonphotography', 'horses', 'thatpnwlife', 'traveloregon', 'nikontop', 'outdoors', 'pnw', 'portland', 'upperleftusa', 'bestoforegon', 'horsesofinstagram', 'horseriding', 'instahorse', 'northwestisbest', 'horse', 'seattle', 'pdx', 'equestrian', 'dressage', 'pacificnorthwest', 'oregon', 'pnwonderland', 'washington', 'pony', 'oregonexplored', 'pferd', 'pnwlife', 'cascadiaexplored', 'pnwcollective']","3/29/18",2018-03-29 09:51:32,"2018"
"43",381,"['explorebc', 'nikonphotography', 'rockclimbing', 'liveclimbrepeat', 'thatpnwlife', 'traveloregon', 'climbing', 'nikontop', 'pnw', 'climb', 'portland', 'upperleftusa', 'bestoforegon', 'northwestisbest', 'seattle', 'pdx', 'climbinglife', 'climber', 'climbing_pictures_of_instagram', 'pacificnorthwest', 'oregon', 'pnwonderland', 'washington', 'sportclimbing', 'oregonexplored', 'pnwlife', 'bouldering', 'cascadiaexplored', 'climbing_is_my_passion', 'pnwcollective']","3/27/18",2018-03-27 09:40:40,"2018"
"44",388,"['roamtheplanet', 'welivetoexplore', 'outinoregon', 'ourplanetdaily', 'thatpnwlife', 'traveloregon', 'oregonnw', 'awakethesoul', 'folksouls', 'pnw', 'folkgreen', 'portland', 'bestoforegon', 'portlandnw', 'pnwdiscovered', 'nature', 'thegreatoutdoors', 'thegreat_pnw', 'bleachmyfilm', 'stayandwander', 'outdoortones', 'mobilemag', 'ournaturedays', 'liveoutdoors', 'pacificnorthwest', 'instagood', 'pnwonderland', 'cascadiaexplored']","3/25/18",2018-03-25 11:55:55,"2018"
"45",547,"['lifestyle', 'hiking', 'instanature', 'naturephotography', 'thenwadventure', 'traveloregon', 'adventure', 'oregonnw', 'naturelovers', 'pnw', 'oregoncoast', 'liveauthentic', 'pnwdiscovered', 'nature', 'youroregon', 'oregonbeach', 'mothernature', 'pnwhikes', 'naturaloregon', 'oregon', 'travel', 'pnwonderland', 'PNWlife', 'oregonexplored', 'sunset', 'pnwbyphone', 'explore', 'cascadiaexplored']","3/23/18",2018-03-23 12:44:10,"2018"
"46",473,"['roamtheplanet', 'welivetoexplore', 'outinoregon', 'ourplanetdaily', 'thatpnwlife', 'traveloregon', 'oregonnw', 'awakethesoul', 'folksouls', 'pnw', 'folkgreen', 'portland', 'bestoforegon', 'portlandnw', 'pnwdiscovered', 'nature', 'thegreatoutdoors', 'thegreat_pnw', 'bleachmyfilm', 'stayandwander', 'outdoortones', 'mobilemag', 'ournaturedays', 'liveoutdoors', 'pacificnorthwest', 'instagood', 'pnwonderland', 'cascadiaexplored']","3/20/18",2018-03-20 11:59:49,"2018"
"47",450,"['roamtheplanet', 'welivetoexplore', 'outinoregon', 'ourplanetdaily', 'thatpnwlife', 'traveloregon', 'oregonnw', 'awakethesoul', 'folksouls', 'pnw', 'folkgreen', 'portland', 'bestoforegon', 'portlandnw', 'pnwdiscovered', 'nature', 'thegreatoutdoors', 'thegreat_pnw', 'bleachmyfilm', 'stayandwander', 'outdoortones', 'mobilemag', 'ournaturedays', 'liveoutdoors', 'pacificnorthwest', 'instagood', 'pnwonderland', 'cascadiaexplored']","3/19/18",2018-03-19 11:15:07,"2018"
"48",1692,"['optoutside', 'maleinfluencer', 'beautyinprogress', 'oregon', 'traveloregon', 'malemodel']","3/11/18",2018-03-11 09:37:01,"2018"
"49",1119,"['traveloregon', 'optoutside', 'pnw', 'hiking', 'bendoregon', 'smithrock', 'pnwonderland', 'smithrocks', 'rockclimbing', 'oregonexplored', 'centraloregon', 'bend', 'smithrockstatepark', 'nature', 'exploreoregon', 'climbing', 'oregon']","3/9/18",2018-03-08 18:56:45,"2018"
"50",2235,"['optoutside', 'ig_today', 'theNWadventure', 'theoutbound', 'BPMag', 'discoverearth', 'ourplanetdaily', 'traveloregon', 'exploreoregon', 'master_shots', 'pnw', 'portland', 'earthofficial', 'sonyalpha', 'thegreatoutdoors', 'photography', 'discoverglobe', 'thatPNWlife', 'oregon', 'BestofOregon', 'folkmagazine', 'bestofthenorthwest', 'scenicPNW', 'pnwonderland', 'rei1440project', 'oregonexplored', 'centraloregon', 'feedbacknation', 'cascadiaexplored']","3/3/18",2018-03-02 18:52:51,"2018"
"51",582,"['oregonlife', 'pnwisbeautiful', 'sonyimages', 'pnwwonderland', 'doandseemore', 'traveloregon', 'oregonnw', 'pnw', 'pnwexplorations', 'pnwisbest', 'bestoforegon', 'pnwdiscovered', 'sonyalpha', 'youroregon', 'artofvisuals', 'sonyalphasclub', 'gameoftones', 'amazingadventures', 'naturefirst', 'pnwonderland', 'pnwlove', 'oregonexplored', 'pnwlife', 'whereigottago', 'pnwcollective']","2/24/18",2018-02-24 12:54:26,"2018"
"52",347,"['dontbuyflowersjuststoptosmellthem', 'gocentraloregon', 'valentinesday', 'acouplewhohikestogetherstaystogether', 'traveloregon']","2/14/18",2018-02-14 08:20:13,"2018"
"53",622,"['pnwisbeautiful', 'travelphotography', 'oregonstate', 'passionpassport', 'forest', 'happy', 'traveloregon', 'oregonnw', 'naturelovers', 'upperleftusa', 'portrait', 'bend', 'glorious', 'nature', 'vscocam', 'visitoregon', 'artofvisuals', 'Smithrock', 'pacificnorthwest', 'oregon', 'godscreation', 'pnwonderland', 'colorful', 'oregonexplored', 'sunset', 'cascadiaexplored']","2/9/18",2018-02-08 18:26:48,"2018"
"54",392,"['ig_captures_nature', 'starwarstoys', 'thenwadventure', 'omht', 'thatpnwlife', 'traveloregon', 'leftcoast', 'staypnw', 'pnw', 'pnwexplorations', 'portland', 'pnwisbest', 'starwars', 'bestoforegon', 'oregoncoast', 'GoBB8', 'pdx', 'adventurevisuals', 'wildernessculture', 'nerd', 'starwarsday', 'oregon', 'bb8starwars', 'bb8', 'pnwonderland', 'toys', 'watchthisinstagood', 'cascadiaexplored']","2/6/18",2018-02-06 08:52:52,"2018"
"55",1465,"['theearthoutdoors', 'bendmag', 'optoutside', 'watchthisinstagood', 'wishyouwerenorthwest', 'uoregon', 'thevisualcollective', 'justinhartney', 'traveloregon', 'smithrock', 'camp4pix', 'beautifuldestinations', 'nature', 'eclipse', 'wildernessculture', 'Ourlonelyplanet', 'thatNWadventure', 'universityoforegon', 'canon_photos', 'visitbend', 'vsco', '1859Oregon', 'LifeasaJstudent', 'folkmagazine', 'nwc10k', 'eugene', 'oregonexplored', 'modernoutdoors', 'feedbacknation', 'lunareclipse']","1/31/18",2018-01-31 11:12:02,"2018"
"56",351,"['traveloregon', 'bestofnorthwest', 'pnwisbeautiful', 'cascadia', 'pnw', 'thatPNWlife', 'Oregon', 'pnwonderland', 'upperleftusa', 'bestoforegon', 'visitpnw', 'northwest', 'oregonexplored', 'thenwadventure', 'northwestisbest', 'pacificnorthwest', 'cascadiaexplored', 'oregonnw', 'pnwcollective']","1/27/18",2018-01-27 10:32:28,"2018"
"57",595,"['optoutside', 'gothere', 'weekendescape', 'bendlife', 'cascadiaexplored', 'wishyouwerenorthwest', 'thebestofbend', 'thatpnwlife', 'traveloregon', 'smithrock', 'exploreoregon', 'explorerbabes', 'upperleftusa', 'bestoforegon', 'weekending', 'travelnow', 'youroregon', 'snowshoe', 'northwestisbest', 'placestovisit', 'adventuregirls', 'sheexplores', 'pnwonderland', 'inbend', 'livetravelchannel', 'oregonexplored', 'wanderwisely', 'herPNWlife', 'pnwcollective']","1/19/18",2018-01-19 09:16:18,"2018"
"58",2134,"['awesomeearth', 'roamtheplanet', 'amazing_longexpo', 'ourplanetdaily', 'traveloregon', 'trappingtones', 'staypnw', 'longexposure_shots', 'bestoforegon', 'liveauthentic', 'travelstoke', 'lifeofadventure', 'pnwdiscovered', 'sonyalpha', 'goneoutdoors', 'thegreat_pnw', 'depthsofearth', 'alphacollective', 'artofvisuals', 'wildernessculture', 'createcommune', 'welltraveled', 'longexpoelite', 'weekly_feature', 'doyoutravel', 'pnwonderland', 'oregonexplored', 'theglobewanderer', 'longexpo_addiction', 'eclectic_shotz']","1/19/18",2018-01-18 19:09:31,"2018"
"59",1192,"['thatoregonlife', 'royalsnappingartists', 'smithrockstatepark', 'thebestofbend', 'thatpnwlife', 'traveloregon', 'main_vision', 'jj_oregon', 'pnw', 'jj_westcoast', 'beautifuldestinations', 'pnwdiscovered', 'youroregon', 'pnwcompass', 'pnwparadise', 'artofvisuals', 'bendoregon', 'oregon', 'jj_nature', 'pnwonderland', 'oregonexplored', 'centraloregon', 'morninglight', 'pnwcollective']","12/18/17",2017-12-18 11:55:50,"2017"
"60",1821,"['travelportland', 'thatoregonlife', 'royalsnappingartists', 'optoutside', 'moodygrams', 'bestofbend', 'thenwadventure', 'thatpnwlife', 'traveloregon', 'smithrock', 'oregonnw', 'climbing', 'jj_oregon', 'pnw', 'portland', 'bend', 'pnwdiscovered', 'mastergallery', 'youroregon', 'earthfocus', 'pnwcompass', 'ig_skyvibes', 'theimaged', 'oregon', 'ig_color', 'pnwonderland', 'oregonexplored', 'sunset', 'cascadiaexplored']","11/23/17",2017-11-22 18:44:50,"2017"
"61",361,"['travelportland', 'traveloregon', 'exploreoregon', 'oregonnw', 'pnw', 'portland', 'upperleftusa', 'bestoforegon', 'pdxeats', 'portlandnw', 'portlandia', 'northwestisbest', 'portlandoregon', 'exploregon', 'rosecity', 'pdx', 'ripcity', 'pdxnow', 'pacificnorthwest', 'oregon', 'pnwonderland', 'downtownpdx', 'trailblazers', 'oregonexplored']","11/19/17",2017-11-19 06:26:35,"2017"
"62",378,"['bestofnorthwest', 'pnwisbeautiful', 'thatoregonlife', 'bestoforegoncoast', 'wildernessmakesyoubetter', 'wildernessnation', 'smithrockstatepark', 'offlineoutdoors', 'natureprimeshot', 'staypnw', 'TravelOregon', 'Bend0regon', 'upperleftusa', 'pnwdiscovered', 'youroregon', 'ourwild', 'wildernessearth', 'bendoregon', 'wildernessculture', 'landscape_captures', 'Bestoforegon', 'theoutdoorfolk', 'Oregonexplored', 'PNWparadise', 'landscapescapture', 'thatPNWlife', 'pnwonderland', 'scenicstates', 'conqueroregon', 'cascadiaexplored']","11/15/17",2017-11-15 15:53:42,"2017"
"63",383,"['welivetoexplore', 'girlswhohike', 'thatpnwlife', 'climbing', 'smithrock', 'oregonnw', 'traveloregon', 'pnw', 'hikelikeagirl', 'upperleftusa', 'pnwisbest', 'bestoforegon', 'pnwdiscovered', 'northwestisbest', 'exploregon', 'wildernessculture', 'pnwbabes', 'naturegirl', 'exploremore', 'pnwonderland', 'discoveroregon', 'oregonexplored', 'cascadiaexplored']","11/6/17",2017-11-05 22:43:35,"2017"
"64",3405,"['wweweekendgetaway', 'womenwhoclimb', 'adventureiswaiting', 'rockclimbing', 'chicswhoclimb', 'visitcentraloregon', 'climbing', 'traveloregon', 'smithrock', 'gocentraloregon', 'wweweekend', 'girlswhoclimb', 'keepexploring', 'adventurecalls', 'chooseyourownadventure', 'rockchic', 'letsgosomewhere', 'bestfriendgoals', 'womenwhoexplore', 'exploremore', 'centraloregon', 'climbingrocks']","10/11/17",2017-10-10 17:15:44,"2017"
"65",3421,"['wweweekendgetaway', 'gocentraloregon', 'wweweekend', 'womenwhoclimb', 'climbing', 'adventurecalls', 'womenwhoexplore', 'rockclimbing', 'chooseyourownadventure', 'centraloregon', 'girlswhoclimb', 'climbingrocks', 'rockchic', 'chicswhoclimb', 'keepexploring', 'visitcentraloregon', 'traveloregon', 'smithrock']","10/7/17",2017-10-07 11:46:28,"2017"
"66",463,"['traveloregon', 'OregonExplored', 'staypnw', 'sonya7r', 'wildernessculture', 'sonyimages', 'smithrock', 'PNWonderland', 'Repost', 'Bestoforegon', 'sony', 'centraloregon', 'sonyalpha', 'thatpnwlife', 'cascadiaexplored', 'oregon']","9/16/17",2017-09-16 07:50:10,"2017"
"67",544,"['legostagram', 'legomania', 'crookedriver', 'dirtbike', 'olympusomdem10markii', 'smithrockstatepark', 'toyplanet', 'wyldstyle', 'traveloregon', 'smithrock', 'womenintoyphotography', 'lego', 'brickcentral', 'legomovie', 'stuckinplastic', 'toyoutsiders', 'legogirlstothefront', 'exploregon', 'legominifigures', 'instalego', 'toy_photographers', 'legophotography', 'pnwcreatives', 'oregon', 'pnwonderland', 'toyartistry_lego', 'afol', 'centraloregon', 'toptoyphotos_lego']","9/16/17",2017-09-15 23:26:38,"2017"
"68",340,"['hiking', 'travelpic', 'girlswhohike', 'smithrockstatepark', 'traveloregon', 'exploreoregon', 'adventure', 'likeamountaingirl', 'mountainview', 'travelgram', 'upperleftusa', 'gramoftheday', 'hike', 'thegreatoutdoors', 'hikingboots', 'girlswhohikeor', 'traveldiary', 'keepitwild', 'adventurethatislife', 'neverstopexploring', 'westcoastbestcoast', 'hikingclubs', 'explore', 'hikingadventures']","8/29/17",2017-08-28 21:40:50,"2017"
"69",323,"['eclipse', 'totality', 'traveloregon', 'oregon']","8/22/17",2017-08-21 21:31:14,"2017"
"70",803,"['gocentraloregon', 'traveloregon', 'solareclipse2017']","8/22/17",2017-08-21 20:19:08,"2017"
"71",590,"['roadtrip', 'passionpassport', 'northwest', 'igersusa', 'smithrockstatepark', 'visittheusa', 'traveloregon', 'smithrock', 'roadtrippers', 'teamroadtrip', 'landscape', 'passionpasseport', 'roadtripusa', 'travelblog', 'chapkatrip', 'northwestisbest', 'travelblogger', 'visitusa', 'visitoregon', 'francaisauxusa', 'visitbend', 'oregon', 'travel', 'neverstopexploring', 'roadtrippin', 'lostintheusa', 'sevenwondersoforegon', 'travelusa']","8/17/17",2017-08-16 21:49:55,"2017"
"72",643,"['oregonweddingphotographer', 'proposal', 'centraloregonengagement', 'exploregon', 'howheasked', 'bendoregon', 'justengaged', 'wanderingphotographers', 'katyweaverphotography', 'proposalstory', 'centraloregon', 'oregonengagement', 'smithrockstatepark', 'sisterphotogs', 'oregonproposal', 'proposalgoals', 'proposalphotos', 'traveloregon', 'smithrock']","8/16/17",2017-08-15 18:37:16,"2017"
"73",380,"['ledgelife', 'outdoorlife', 'pnwonderland', 'departedoutdoors', 'upperleftusa', 'withoutwalls', 'ourcamplife', 'oregonexplored', 'wearethewild', 'memoriesbeforestuff', 'trailtime', 'pnwlife', 'wanderlust', 'goatworthy', 'liveauthentic', 'lifeofadventure', 'traveloregon', 'pnwblessed', 'meetthemoment', 'pnwcollective']","7/24/17",2017-07-24 06:57:30,"2017"
"74",1295,"['photography', 'fitness', 'fitfam', 'travelphotography', 'travel', 'fitspo', 'fitspiration', 'hike', 'pacificnorthwest', 'traveloregon', 'smithrock']","7/24/17",2017-07-23 17:21:23,"2017"
"75",341,"['hiking', 'girlswhohike', 'thatpnwlife', 'blondehairdontcare', 'smithrock', 'climbing', 'traveloregon', 'oregongirl', 'pnw', 'pnwgirl', 'oregonian', 'wanderer', 'hiker', 'wildheart', 'exploregon', 'wildandfree', 'explorer', 'gooutside', 'blonde', 'wanderlust', 'oregon', 'rockclimber', 'herpnwlife', 'pnwonderland', 'pnwoutdoorwomen', 'girlswithtats', 'oregonexplored', 'adventures', 'countrygirl', 'cascadiaexplored']","6/21/17",2017-06-20 23:33:58,"2017"
"76",516,"['hiking', 'girlswhohike', 'thatpnwlife', 'blondehairdontcare', 'smithrock', 'climbing', 'traveloregon', 'oregongirl', 'pnw', 'pnwgirl', 'oregonian', 'wanderer', 'hiker', 'wildheart', 'exploregon', 'wildandfree', 'explorer', 'gooutside', 'blonde', 'wanderlust', 'oregon', 'rockclimber', 'herpnwlife', 'pnwonderland', 'pnwoutdoorwomen', 'girlswithtats', 'oregonexplored', 'adventures', 'countrygirl', 'cascadiaexplored']","6/20/17",2017-06-20 13:58:30,"2017"
"77",643,"['hiking', 'girlswhohike', 'thatpnwlife', 'blondehairdontcare', 'smithrock', 'climbing', 'traveloregon', 'oregongirl', 'pnw', 'pnwgirl', 'oregonian', 'wanderer', 'hiker', 'pnwdiscovered', 'wildheart', 'exploregon', 'wildandfree', 'explorer', 'gooutside', 'blonde', 'wanderlust', 'oregon', 'rockclimber', 'herpnwlife', 'pnwonderland', 'pnwoutdoorwomen', 'girlswithtats', 'oregonexplored', 'adventures', 'cascadiaexplored']","6/20/17",2017-06-20 03:27:16,"2017"
"78",643,"['hiking', 'girlswhohike', 'thatpnwlife', 'blondehairdontcare', 'smithrock', 'climbing', 'traveloregon', 'oregongirl', 'pnw', 'pnwgirl', 'oregonian', 'wanderer', 'hiker', 'wildheart', 'exploregon', 'wildandfree', 'explorer', 'gooutside', 'blonde', 'wanderlust', 'oregon', 'rockclimber', 'herpnwlife', 'pnwonderland', 'pnwoutdoorwomen', 'girlswithtats', 'oregonexplored', 'adventures', 'countrygirl', 'cascadiaexplored']","6/19/17",2017-06-19 14:27:33,"2017"
"79",410,"['pnwworderland', 'naturephotography', 'thenwadventure', 'picoftheday', 'geologyrocks', 'traveloregon', 'smithrock', 'oregonnw', 'travelgram', 'naturelovers', 'bestoforegon', 'reflection', 'sonyalpha', 'northwestisbest', 'oregonadventures', 'artofvisuals', 'ig_worldclub', 'landscapelovers', 'pacificnorthwest', 'oregon', 'keepitwild', 'instagood', 'ig_nature', 'travel', 'oregonexplored', 'igworldclub_landscape', 'BD']","6/18/17",2017-06-18 12:30:32,"2017"
"80",583,"['hiking', 'girlswhohike', 'thatpnwlife', 'blondehairdontcare', 'smithrock', 'climbing', 'traveloregon', 'oregongirl', 'pnw', 'pnwgirl', 'oregonian', 'wanderer', 'hiker', 'wildheart', 'exploregon', 'wildandfree', 'explorer', 'gooutside', 'blonde', 'wanderlust', 'oregon', 'rockclimber', 'herpnwlife', 'pnwonderland', 'pnwoutdoorwomen', 'girlswithtats', 'oregonexplored', 'adventures', 'countrygirl', 'cascadiaexplored']","6/18/17",2017-06-18 07:25:21,"2017"
"81",875,"['hiking', 'girlswhohike', 'thatpnwlife', 'blondehairdontcare', 'smithrock', 'climbing', 'traveloregon', 'oregongirl', 'pnw', 'pnwgirl', 'oregonian', 'wanderer', 'hiker', 'wildheart', 'exploregon', 'wildandfree', 'explorer', 'gooutside', 'blonde', 'wanderlust', 'oregon', 'rockclimber', 'herpnwlife', 'pnwonderland', 'pnwoutdoorwomen', 'girlswithtats', 'oregonexplored', 'adventures', 'countrygirl', 'cascadiaexplored']","6/17/17",2017-06-16 23:50:46,"2017"
"82",390,"['theNWadventure', 'purplepassport', 'rockclimbing', 'pnwwonderland', 'ig_shotz', 'traveloregon', 'ig_landscape', 'oregonnw', 'outdoors', 'jj_oregon', 'team_canon', 'explore_earth_', 'mthrworld', 'bestoforegon', 'globalcapture', 'pnwdiscovered', 'nature', 'youroregon', 'pnw_compass', 'awesome_phototrip', 'oregon', 'westcoast_exposures', 'oregonexplored', 'everything_imaginable', 'mountains', 'exceptional_pictures', 'cascadiaexplored', 'pnwcollective']","5/30/17",2017-05-30 16:04:25,"2017"
"83",1260,"['traveloregon', 'pnwisbeautiful', 'thatoregonlife', 'jj_oregon', 'pnw', 'pnwonderland', 'beauty', 'oregonexplored', 'river', 'centraloregon', 'mountains', 'smithrockstatepark', 'pnwdiscovered', 'youroregon', 'thebestofbend', 'thatpnwlife', 'cascadiaexplored', 'oregon', 'pnwcollective']","5/21/17",2017-05-21 08:14:23,"2017"
"84",448,"['pnwworderland', 'moodygrams', 'naturephotography', 'thenwadventure', 'picoftheday', 'geologyrocks', 'traveloregon', 'smithrock', 'oregonnw', 'travelgram', 'naturelovers', 'bestoforegon', 'sonyalpha', 'northwestisbest', 'oregonadventures', 'artofvisuals', 'ig_worldclub', 'landscapelovers', 'pacificnorthwest', 'oregon', 'keepitwild', 'instagood', 'ig_nature', 'travel', 'oregonexplored', 'igworldclub_landscape', 'BD']","5/21/17",2017-05-21 07:51:28,"2017"
"85",357,"['pnwisbeautiful', 'optoutside', 'rockclimbing', 'cascadiaexplored', 'adventurenthusiasts', 'thenwadventure', 'smithrockstatepark', 'thebestofbend', 'traveloregon', 'oregonnw', 'pnw', 'thehikemovement', 'youroregon', 'pnwparadise', 'theadventureproject', 'wildernessculture', 'findyouradventure', 'visitbend', 'liveyouradventure', 'pacificnorthwest', 'alltrails', 'hikingculture', 'pnwonderland', 'getoutside', 'neverstopexploring', 'oregonexplored', 'wildernessvibes', 'StepSwiftly', 'modernoutdoors', 'hikingadventures']","5/19/17",2017-05-19 06:37:19,"2017"
"86",393,"['climbingphotography', 'rockclimbing', 'multipitch', 'bestofbend', 'smithrockstatepark', 'like4likes', 'followtrain', 'climbing', 'bestcoast', 'traveloregon', 'smithrock', 'brambleoutdoor', 'agameoftones', 'vscogood', 'bramble', 'daypack', 'bestoforegon', 'exploreeverything', 'takemehere', 'wildernessculture', 'welltraveled', 'backpacker', 'vscogrid', 'liveoutdoors', 'wanderlust', 'tasteintravel', 'pnwonderland', 'backpacking', 'pnwcollective']","5/16/17",2017-05-16 15:08:18,"2017"
"87",347,"['climbingphotography', 'rockclimbing', 'multipitch', 'bestofbend', 'smithrockstatepark', 'like4likes', 'followtrain', 'climbing', 'bestcoast', 'traveloregon', 'smithrock', 'brambleoutdoor', 'agameoftones', 'bramble', 'daypack', 'bestoforegon', 'exploreeverything', 'takemehere', 'wildernessculture', 'welltraveled', 'backpacker', 'liveoutdoors', 'wanderlust', 'tasteintravel', 'pnwonderland', 'backpacking', 'pnwcollective']","5/16/17",2017-05-15 17:09:55,"2017"
"88",331,"['theoutbound', 'sunrisesandmimosas', 'wearestillwild', 'thebestofbend', 'thatpnwlife', 'traveloregon', 'exploreoregon', 'oregonnw', 'instagood10k', 'pnw', 'pnwexplorations', 'northwestcreatives', 'upperleftusa', 'exploreeverything', 'bestoforegon', 'mavicpro', 'exklusive_shot', 'northwestisbest', 'exploregon', 'artofvisuals', 'letsgosomewhere', 'pacificnorthwest', 'oregon', 'instagoodmyphoto', 'neverstopexploring', 'oregonexplored', 'pnwlife', 'explore', 'cascadiaexplored']","5/12/17",2017-05-12 07:45:43,"2017"
"89",442,"['pnwisbeautiful', 'optoutside', 'rockclimbing', 'cascadiaexplored', 'adventurenthusiasts', 'thenwadventure', 'smithrockstatepark', 'thebestofbend', 'traveloregon', 'oregonnw', 'pnw', 'thehikemovement', 'youroregon', 'pnwparadise', 'theadventureproject', 'wildernessculture', 'findyouradventure', 'visitbend', 'liveyouradventure', 'pacificnorthwest', 'alltrails', 'hikingculture', 'pnwonderland', 'getoutside', 'neverstopexploring', 'oregonexplored', 'wildernessvibes', 'StepSwiftly', 'modernoutdoors', 'hikingadventures']","5/9/17",2017-05-09 08:50:25,"2017"
"90",399,"['pnwisbeautiful', 'optoutside', 'rockclimbing', 'cascadiaexplored', 'adventurenthusiasts', 'thenwadventure', 'smithrockstatepark', 'thebestofbend', 'traveloregon', 'oregonnw', 'pnw', 'thehikemovement', 'youroregon', 'pnwparadise', 'theadventureproject', 'wildernessculture', 'findyouradventure', 'visitbend', 'liveyouradventure', 'pacificnorthwest', 'alltrails', 'hikingculture', 'pnwonderland', 'getoutside', 'neverstopexploring', 'oregonexplored', 'wildernessvibes', 'StepSwiftly', 'modernoutdoors', 'hikingadventures']","5/8/17",2017-05-08 08:37:56,"2017"
"91",801,"['awesome_naturepix', 'roamtheplanet', 'exploringtheglobe', 'hiking', 'theoutbound', 'sunset_vision', 'thevisualcollective', 'awesomedreamplaces', 'traveloregon', 'mountain', 'agameoftones', 'greatnorthco', 'northwestcreatives', 'pearlcyprus', 'global_hotshotz', 'wow_planet', 'awesome_earthpix', 'travelawesome', 'wildernessculture', 'naturerad', 'oregon', 'earthpix', 'wonderful_places', 'majestic_earth_', 'pnwonderland', 'oregonexplored', 'magicpict', 'superhubs', 'cascadiaexplored']","5/5/17",2017-05-05 13:09:33,"2017"
"92",444,"['oregon2017', 'bestoforegon', 'centraloregon', 'oregon', 'smithrockstatepark', 'statepark', 'hike', 'scenic', 'traveloregon', 'smithrock']","4/25/17",2017-04-24 22:29:08,"2017"
"93",784,"['theearthoutdoors', 'bendmag', 'optoutside', 'ThatPNWLife', 'watchthisinstagood', 'wishyouwerenorthwest', 'uoregon', 'thevisualcollective', 'justinhartney', 'pnwwonderland', 'traveloregon', 'beautifuldestinations', 'nature', 'wildernessculture', 'Ourlonelyplanet', 'thatNWadventure', 'universityoforegon', 'canon_photos', 'underwaterphotography', 'visitbend', 'vsco', '1859Oregon', 'folkmagazine', 'nwc10k', 'eugene', 'llbeanmoment', 'oregonexplored', 'modernoutdoors', 'feedbacknation', 'columbia1938']","4/22/17",2017-04-22 10:10:13,"2017"
"94",730,"['traveloregon', 'smithrock']","4/10/17",2017-04-09 17:16:58,"2017"
"95",398,"['nationalpuppyday', 'theoutbound', 'puppy', 'thebestofbend', 'thatpnwlife', 'traveloregon', 'exploreoregon', 'oregonnw', 'instagood10k', 'pnw', 'pnwexplorations', 'northwestcreatives', 'upperleftusa', 'exploreeverything', 'bestoforegon', 'folkportraits', 'exklusive_shot', 'northwestisbest', 'portraitmood', 'exploregon', 'artofvisuals', 'pacificnorthwest', 'oregon', 'portraiture', 'instagoodmyphoto', 'neverstopexploring', 'oregonexplored', 'pnwlife', 'explore', 'cascadiaexplored']","3/23/17",2017-03-23 16:51:41,"2017"
"96",524,"['moodygrams', 'folkportrait', 'darlingmovement', 'verilymoment', 'explore', 'smithrockstatepark', 'thatpnwlife', 'traveloregon', 'livefolk', 'adventure', 'thehappynow', 'lifeinlevis', 'agameoftones', 'pnw', 'finditliveit', 'liveauthentic', 'wife', 'portlandcouple', 'folkgood', 'loveauthentic', 'cedarandswoon', 'helloadventure', 'theartofslowliving', 'livethelittlethings', 'photobugcommunity', 'exploremore', 'loveandwildhearts', 'teammarried', 'oregonexplored', 'thatsdarling']","3/23/17",2017-03-22 19:01:16,"2017"
"97",452,"['pnwisbeautiful', 'hiking', 'theNWadventure', 'rockclimbing', 'nikond7200', 'cascadiaexplored', 'visitcentraloregon', 'thebestofbend', 'traveloregon', 'smithrock', 'oregonnw', 'landscape', 'jj_oregon', 'pnw', 'upperleftusa', 'bestoforegon', 'visitpnw', 'pnwdiscovered', 'youroregon', 'portlandoregon', 'exploregon', 'pdx', 'wildernessculture', 'pdxnow', 'iloveoregon', 'pnwonderland', 'oregonexplored', 'conqueroregon', 'winter']","3/21/17",2017-03-20 18:11:19,"2017"
"98",662,"['pnwisbeautiful', 'hiking', 'theNWadventure', 'nikond7200', 'cascadiaexplored', 'visitcentraloregon', 'thebestofbend', 'traveloregon', 'smithrock', 'oregonnw', 'landscape', 'jj_oregon', 'pnw', 'upperleftusa', 'bestoforegon', 'visitpnw', 'pnwdiscovered', 'youroregon', 'goldenhour', 'portlandoregon', 'exploregon', 'pdx', 'wildernessculture', 'pdxnow', 'iloveoregon', 'pnwonderland', 'oregonexplored', 'conqueroregon', 'winter']","3/16/17",2017-03-16 06:48:23,"2017"
"99",452,"['greatnorthcollective', 'exploretocreate', 'theoutbound', 'thenwadventure', 'ourplanetdaily', 'thatpnwlife', 'traveloregon', 'exploreoregon', 'oregonnw', 'wanderfolk', 'staypnw', 'folkcreative', 'northwestcreatives', 'upperleftusa', 'bestoforegon', 'lifeofadventure', 'thegreatoutdoors', 'stayandwander', 'folkvibe', 'wildernessculture', 'folkscenery', 'theoutdoorfolk', 'adventurepic', 'exploremore', 'pnwonderland', 'modernoutdoorsman', 'oregonexplored', 'simplyadventure', 'modernoutdoors', 'cascadiaexplored']","3/16/17",2017-03-15 20:05:39,"2017"
"100",455,"['pnwisbeautiful', 'hiking', 'theNWadventure', 'rockclimbing', 'nikond7200', 'cascadiaexplored', 'visitcentraloregon', 'thebestofbend', 'traveloregon', 'smithrock', 'oregonnw', 'landscape', 'jj_oregon', 'pnw', 'upperleftusa', 'bestoforegon', 'visitpnw', 'pnwdiscovered', 'youroregon', 'portlandoregon', 'exploregon', 'pdx', 'wildernessculture', 'pdxnow', 'iloveoregon', 'pnwonderland', 'oregonexplored', 'conqueroregon', 'winter']","3/14/17",2017-03-14 06:46:39,"2017"
"101",370,"['moodygrams', 'folkportrait', 'darlingmovement', 'verilymoment', 'explore', 'smithrockstatepark', 'thatpnwlife', 'traveloregon', 'livefolk', 'adventure', 'thehappynow', 'lifeinlevis', 'agameoftones', 'pnw', 'finditliveit', 'liveauthentic', 'wife', 'portlandcouple', 'folkgood', 'loveauthentic', 'cedarandswoon', 'helloadventure', 'theartofslowliving', 'livethelittlethings', 'photobugcommunity', 'exploremore', 'loveandwildhearts', 'teammarried', 'oregonexplored', 'thatsdarling']","3/6/17",2017-03-06 09:14:48,"2017"
"102",701,"['traveloregon', 'smithrock']","3/2/17",2017-03-02 12:11:54,"2017"
"103",846,"['hiking', 'moment', 'rockclimbing', 'smithrockstatepark', 'adventure', 'exploreoregon', 'traveloregon', 'smithrock', 'oregonnw', 'redmond', 'pnw', 'nature', 'hike', 'photocontest', 'momentlens', 'picturecontest', 'vivitar', 'tagafriend', 'trail', 'Giveaway', 'pacificnorthwest', 'facebook', 'statepark', 'explore', 'contest']","2/26/17",2017-02-26 09:23:28,"2017"
"104",2091,"['hiking', 'smithrockstatepark', 'traveloregon', 'exploreoregon', 'smithrock', 'USA', 'travelgram', 'redmond', 'ig_hiking', 'outdoorwomen', 'highdesert', 'ig_oregon', 'idratherbeinnature', 'pnwcollective', 'oregon', 'wanderlust', 'pnwonderland', 'terrebonne', 'centraloregon', 'hikingadventures', 'instapassport']","2/20/17",2017-02-19 21:42:12,"2017"
"105",827,"['postcardsfromtheworld', 'wonderfulworld', 'travelbloggers', 'smithrockstatepark', 'discoverearth', 'traveloregon', 'smithrock', 'oregonnw', 'desert', 'PNWdiscovered', 'upperleftusa', 'bestoforegon', 'desertlife', 'youroregon', 'couplestravel', 'landscapephotos', 'bendoregon', 'resourcemag', 'losttribemag', 'visualsofearth', 'timeoutsociety', 'special_shots', 'oregonexplored', 'theglobewanderer', 'viewbugfeature', 'cascadiaexplored', 'PNwonderland']","2/16/17",2017-02-16 11:38:10,"2017"
"106",1545,"['ig_humanplus', 'travelgram', 'ravine', 'redmond', 'idratherbeinnature', 'redrock', 'hiking', 'canyon', 'smithrock', 'terrebonne', 'miseryridge', 'ig_oregon', 'smithrockstatepark', 'wanderlust', 'hikingadventures', 'exploreoregon', 'traveloregon', 'oregon', 'instapassport']","2/12/17",2017-02-11 21:57:37,"2017"
"107",878,"['theearthoutdoors', 'bendmag', 'optoutside', 'ThatPNWLife', 'watchthisinstagood', 'wishyouwerenorthwest', 'uoregon', 'thevisualcollective', 'justinhartney', 'pnwwonderland', 'traveloregon', 'smithrock', 'beautifuldestinations', 'nature', 'wildernessculture', 'Ourlonelyplanet', 'thatNWadventure', 'universityoforegon', 'canon_photos', 'visitbend', 'vsco', '1859Oregon', 'folkmagazine', 'nwc10k', 'eugene', 'llbeanmoment', 'oregonexplored', 'modernoutdoors', 'feedbacknation', 'columbia1938']","2/6/17",2017-02-06 10:00:34,"2017"
"108",2000,"['ig_masterpiece', 'theearthoutdoors', 'huffpostgram', 'wishyouwerenorthwest', 'sunset_vision', 'FeedbackNation', 'thatpnwlife', 'traveloregon', 'oregonnw', 'pnw', 'IG_Mood', 'bend', 'RoyalSnappingArtists', 'Insta_Crew', 'click_vision', 'urbanandstreet', 'oregon', 'wonderful_places', 'ig_color', 'pnwonderland', 'oregonexplored', 'illgrammers', 'ItsAmazingOutThere', 'meistershots', 'pnwcollective']","1/29/17",2017-01-28 20:22:23,"2017"
"109",2283,"['bestofnorthwest', 'optoutside', 'theoutbound', 'bestofbend', 'picoftheday', 'traveloregon', 'smithrock', 'oregonnw', 'jj_oregon', 'pnw', 'portland', 'jj_westcoast', 'bestoforegon', 'adventurrculture', 'icu_usa', 'portlandia', 'northwestisbest', 'exploregon', 'pdx', 'bendoregon', 'wildernessculture', 'oregon', 'wanderlust', 'just_unitedstates', 'discoveroregon', 'pnwonderland', 'westcoast_exposures', 'oregonexplored', 'cascadiaexplored', 'pnwcollective']","12/26/16",2016-12-25 16:06:37,"2016"
"110",394,"['traveloregon']","11/29/16",2016-11-29 15:58:51,"2016"
"111",2677,"['traveloregon', 'beautifuldestinations']","11/22/16",2016-11-21 20:18:28,"2016"
"112",557,"['wanderlusting', 'travelphotography', 'getoutstayout', 'pnwimage', 'visitcentraloregon', 'thebestofbend', 'thatpnwlife', 'traveloregon', 'exploreoregon', 'intrepidtravel', 'mytinyatlas', 'bestoforegon', 'girlslovetravel', 'youroregon', 'soultravelers', 'stayandwander', 'bendoregon', 'travelauthentic', 'visitbend', 'travelbug', 'conquerOregon', 'choosemountains', 'tasteintravel', 'exploremore', 'pnwonderland', 'neverstopexploring', 'adventureseeker', 'oregonexplored', 'thatadventurelife', 'cascadiaexplored']","11/21/16",2016-11-20 20:50:01,"2016"
"113",485,"['wanderlusting', 'travelphotography', 'getoutstayout', 'visitcentraloregon', 'thebestofbend', 'thatpnwlife', 'traveloregon', 'exploreoregon', 'smithrock', 'intrepidtravel', 'mytinyatlas', 'bestoforegon', 'girlslovetravel', 'youroregon', 'soultravelers', 'stayandwander', 'bendoregon', 'travelauthentic', 'visitbend', 'travelbug', 'conquerOregon', 'tasteintravel', 'exploremore', 'pnwonderland', 'livetravelchannel', 'neverstopexploring', 'adventureseeker', 'oregonexplored', 'thatadventurelife', 'cascadiaexplored']","11/6/16",2016-11-06 15:32:51,"2016"
"114",426,"['waycoolshots', 'canon_usa', 'jj_oregon', 'pnwonderland', 'smithrock', 'rei1440project', 'oregonexplored', 'cascadiaexplored', 'portlandnw', 'pnwdiscovered', 'youroregon', 'wowshot', 'traveloregon', 'oregon', 'instagram']","9/21/16",2016-09-21 12:34:07,"2016"
"115",747,"['dametraveller', 'roamtheplanet', 'passionpassport', 'darlingescapes', 'campvibes', 'traveloregon', 'livefolk', 'stayadventurous', 'agameoftones', 'mytinyatlas', 'liveauthentic', 'traveldeeper', 'exklusive_shot', 'instavideo', 'lonelyplanet', 'adventureawaits', 'adventurecalls', 'nomadstories', 'electrifytravels', 'tasteintravel', 'travelwithaninsider', 'neverstopexploring', 'lifewelltravelled']","8/31/16",2016-08-31 16:28:57,"2016"
"116",2536,"['traveloregon']","8/26/16",2016-08-26 14:23:00,"2016"
"117",2516,"['photoarena_nature', 'naturehippys', 'iphone', 'water_perfection', 'bestofbend', 'traveloregon', 'smithrock', 'oregonnw', 'bns_waters', 'jj_oregon', 'sunrise', 'bestoforegon', 'nature_sultans', 'nature', 'youroregon', 'iphoneonly', 'ffn_member', 'pocket_allnature', 'bendoregon', 'iphoneography', 'oregon', 'tv_allnature', 'nature_wizards', 'ptk_nature', 'pnwonderland', 'inbend', 'iphone6S', 'oregonexplored', 'nature_perfection']","8/18/16",2016-08-18 10:11:32,"2016"
"118",418,"['optoutside', 'climb', 'rockclimb', 'NoFilter', 'getoutside', 'centraloregon', 'statepark', 'traveloregon']","8/11/16",2016-08-11 12:07:21,"2016"
"119",361,"['ig_today', 'loves_reflections', 'nakedplanet', 'igglobalclub', 'worldplaces', 'fantastic_earth', 'worldshotz', 'ourplanetdaily', 'thebestofbend', 'theworldshotz', 'traveloregon', 'BestOfOregon', 'ig_exquisite', 'igworldclub', 'igglobalwomenclub', 'worldcaptures', 'global_hotshotz', 'nature_brilliance', 'wbg_members', 'usinterior', 'awesome_earthpix', 'earthfocus', 'igbest_shotz', 'ig_worldclub', 'water_brilliance', 'special_shots', 'big_shotz', 'oregonexplored', 'cascadiaexplored', 'nature_perfection']","7/16/16",2016-07-15 18:49:12,"2016"
"120",2682,"['bestofnorthwest', 'optoutside', 'theoutbound', 'rockclimbing', 'picoftheday', 'traveloregon', 'smithrock', 'oregonnw', 'jj_oregon', 'pnw', 'portland', 'jj_westcoast', 'bestoforegon', 'liveauthentic', 'icu_usa', 'portlandia', 'northwestisbest', 'exploregon', 'pdx', 'bendoregon', 'wildernessculture', 'oregon', 'wanderlust', 'just_unitedstates', 'discoveroregon', 'pnwonderland', 'oregonexplored', 'cascadiaexplored', 'pnwcollective']","6/18/16",2016-06-18 09:47:39,"2016"
"121",894,"['radgirlslife', 'bendite', 'everytrailconnects', 'andshesdopetoo', 'theoutbound', 'traveloregon', 'smithrock', 'wearethewild', 'outsideculture', 'outdoorwomen', 'outdoorbella', 'pnwhikers', 'girlgetoutside', 'exploregon', 'womenwhohike', 'theadventureproject', 'bendoregon', 'theoutdoorfolk', 'earthgirladventures', '52hikechallenge', 'hikingculture', 'herpnwlife', 'sheexplores', 'pnwoutdoorwomen', 'mountaingirls', 'werehikers', 'hikingadventures', 'wildernessbabes']","5/22/16",2016-05-22 07:42:15,"2016"
"122",1185,"['WomenWhoHike', 'radgirlslife', 'everytrailconnects', 'andshesdopetoo', 'theoutbound', 'traveloregon', 'smithrock', 'wearethewild', 'outsideculture', 'outdoorwomen', 'outdoorbella', 'pnwhikers', 'girlgetoutside', 'exploregon', 'womenwhohike', 'theadventureproject', 'bendoregon', 'theoutdoorfolk', 'choosemountains', 'earthgirladventures', '52hikechallenge', 'hikingculture', 'herpnwlife', 'sheexplores', 'pnwoutdoorwomen', 'mountaingirls', 'werehikers', 'hikingadventures', 'wildernessbabes']","5/19/16",2016-05-19 07:16:43,"2016"
"123",407,"['traveloregon', 'smithrock', 'bestoforegon', 'alisaandherfamilyadventures']","5/14/16",2016-05-14 07:48:02,"2016"
"124",352,"['traveloregon', 'smithrock', 'bestoforegon', 'alisaandherfamilyadventures']","5/13/16",2016-05-13 12:58:13,"2016"
"125",1679,"['bevisuallyinspired', 'optoutside', 'OurLonelyPlanet', 'theNWadventure', 'ThatPNWLife', 'watchthisinstagood', 'ourplanetdaily', 'traveloregon', 'tentree', 'lifeofadventure', 'liveauthentic', 'exklusive_shot', 'instagram', 'artofvisuals', 'bendoregon', 'thevisualscollective', 'wildernessculture', 'ourcamplife', 'WeLiveToExplore', 'canon_photos', 'thetrickytree', 'folkmagazine', 'pnwonderland', 'adventurethatislife', 'oregonexplored', 'modernoutdoors', 'feedbacknation']","5/11/16",2016-05-10 21:46:05,"2016"
"126",375,"['sevenwonders', 'cascadia', 'waycoolshots', 'canon_usa', 'jj_oregon', 'pnwonderland', 'smithrock', 'rei1440project', 'oregonexplored', 'cascadiaexplored', 'portlandnw', 'pnwdiscovered', 'youroregon', 'wowshot', 'traveloregon', 'oregon', 'instagram']","5/1/16",2016-05-01 12:53:42,"2016"
"127",350,"['waycoolshots', 'canon_usa', 'jj_oregon', 'pnwonderland', 'bendoregon', 'rei1440project', 'oregonexplored', 'cascadiaexplored', 'portlandnw', 'pnwdiscovered', 'visitbend', 'youroregon', 'wowshot', 'traveloregon', 'oregon', 'instagram']","4/28/16",2016-04-28 08:54:43,"2016"
"128",2305,"['traveloregon', 'smithrock', 'Stellerstories']","3/5/16",2016-03-05 08:36:12,"2016"
"129",1851,"['traveloregon']","2/13/16",2016-02-12 19:11:47,"2016"
"130",334,"['thatoregonlife', 'theoutbound', '1859oregon', 'PNWonderland', 'pacificstates', 'thebestofbend', 'thatpnwlife', 'traveloregon', 'oregonnw', 'backyardoregon', 'agameoftones', 'upperleftusa', 'briskoutdoors', 'global_hotshotz', 'bestoforegon', 'beautifuldestinations', 'visitpnw', 'youroregon', 'exklusive_shot', 'muddycamper', 'viewoforegon', 'livewildbefree', 'wildernessculture', 'visitbend', 'jj_Oregon', 'campingcollective', 'oregonexplored', 'hipcamp', 'watchthisinstagood', 'cascadiaexplored']","1/14/16",2016-01-14 07:36:19,"2016"
"131",413,"['thatoregonlife', 'theoutbound', '1859oregon', 'PNWonderland', 'pacificstates', 'thebestofbend', 'thatpnwlife', 'traveloregon', 'oregonnw', 'backyardoregon', 'agameoftones', 'upperleftusa', 'briskoutdoors', 'global_hotshotz', 'bestoforegon', 'beautifuldestinations', 'visitpnw', 'youroregon', 'exklusive_shot', 'muddycamper', 'viewoforegon', 'livewildbefree', 'wildernessculture', 'visitbend', 'jj_Oregon', 'campingcollective', 'oregonexplored', 'hipcamp', 'watchthisinstagood', 'cascadiaexplored']","1/9/16",2016-01-08 18:44:52,"2016"
"132",470,"['optoutside', 'theNWadventure', 'huffpostgram', 'theoutbound', 'explore', 'campvibes', 'outdoorphotography', 'traveloregon', 'featuremeinstagood', 'exploretheoutdoors', 'nikon', 'lifeofadventure', 'youroregon', 'colors_of_day', 'instagram', 'thenortherncollective', 'livewildbefree', 'borntoroam', 'theoutdoorfolk', 'photooftheday', 'inspiring_photography_admired', 'climbing_pictures_of_instagram', 'pnwonderland', 'in2nature', 'neverstopexploring', 'oregonexplored', 'wilderness_addict', 'instadaily', 'pnwcollective']","12/17/15",2015-12-16 23:17:06,"2015"
"133",623,"['visitoregon', 'Oregon', 'smithrock', 'bestoforegon', 'oregonexplored', 'centraloregon', 'oregonoutdoors', 'iloveoregon', 'traveloregon', 'exploreoregon']","11/10/15",2015-11-10 11:10:22,"2015"
"134",345,"['solotravel', 'Oregon', 'TravelOregon', 'travel', 'rocks', 'travelchronicle', 'beauty', 'COATA', 'travelstoke', 'roadtrippin', 'mountains', 'nature', 'trip']","10/13/15",2015-10-12 19:48:00,"2015"
"135",407,"['7wonders', 'wearestillwild', 'traveloregon', 'smithrock']","4/26/15",2015-04-26 12:24:42,"2015"
"136",4062,"['wearestillwild', 'traveloregon', 'smithrock']","4/26/15",2015-04-26 12:13:59,"2015"
"137",2563,"['bigmtndreams', 'traveloregon']","2/13/15",2015-02-12 16:55:56,"2015"
"138",3452,"['traveloregon']","2/13/15",2015-02-12 16:36:40,"2015"
"139",2628,"['exploregon', 'pnw', 'pacificnorthwest', 'discoveroregon', 'upperleftusa', 'milkyway', 'oregonexplored', 'stars', 'iloveoregon', 'traveloregon', 'oregon']","12/19/14",2014-12-18 22:58:42,"2014"
"140",336,"['travel', 'traveloregon', 'smithrock']","11/18/14",2014-11-17 20:03:57,"2014"
"141",382,"['andasatellite', 'traveloregon', 'starcircles']","7/29/14",2014-07-28 19:07:49,"2014"
"142",3054,"['instameet', 'instapdx', 'instacamppdx', 'igers_portland', 'traveloregon']","7/26/14",2014-07-25 22:05:53,"2014"
"143",323,"['sunset', 'pnw', 'hiking', 'pdx', 'smithrock', 'upperleftusa', 'oregonwild', 'sky', 'portland', 'instapdx', 'oregonexplored', 'rsa_sky', 'skyporn', 'portlandnw', 'instacamppdx', 'hike', 'northwestisbest', 'traveloregon', 'oregon', 'sunflare']","7/26/14",2014-07-25 19:14:14,"2014"
"144",1523,"['explorebc', 'rei1440project', 'wanderlust', 'travel', 'adventure', 'traveloregon', 'pnw', 'pnwisbeautiful', 'natgeo', 'oregon', 'washington', 'wander']","7/21/18",2018-07-20 17:55:33,"2018"
"145",358,"['smithrockstatepark', 'dogswhohike', 'hikingadventures', 'traveloften', 'goldendoodles', 'traveloregon', 'smithrock', 'oregonexplored', 'rvtravel', 'roadtripguide', 'travelguide', 'adventureseekers', 'goldendoodlesofinstagram', 'rvlife', 'bendoregon', 'oregon', 'traveldogs', 'exploreoregon', 'winnebagolife', 'oregonstateparks']","3/2/19",2019-03-02 11:00:53,"2019"
"146",789,"['jj_oregon', 'outinoregon', 'centraloregon', 'awesomeglobe', 'staypnw', 'inbend', 'traveloregon', 'sonorthwest', 'discoverglobe', 'northwestcreatives', 'getoutstayout', '_epic_landscape', 'earthfocus', 'worldshares', 'theimaged', 'landscape_lovers', 'awesome_earthpix', 'destination', 'westbysouthwest', 'splendid_shotz', 'visualsoflife', 'wonderful', 'thegreatpnw', 'backyardbend', 'majesticearth', 'compassoutdoors', 'ig_shotz', 'thenwadventure']","2/15/19",2019-02-14 16:46:45,"2019"
"147",2191,"['pmgridchallenge', 'shutterfly', 'hiking', 'themoderndayexplorer', 'f4', 'alphacollective', 'optoutside', 'pnw', 'gurushots', 'shutterstockcontributors', 'oregon', 'a7RIII', 'idhikethat', 'sonyalpha', 'gettyimages', 'vsco', 'ifonlyweshoot', 'SmithRockStatePark', 'sonyalphasclub', 'smithrock', 'bealpha', 'idhikethatcrew', 'TravelOregon', '24105mm', '500px', 'sonyworldclub', 'shutterstock']","11/30/18",2018-11-30 15:21:33,"2018"
"148",726,"['pnwonderland', 'pnwlife', 'ourplanetdaily', 'oregonadventures', 'folkgood', 'thegreat_pnw', 'pnwisbeautiful', 'optoutside', 'folkgreen', 'smithrockstatepark', 'rockclimbing', 'northwestexplored', 'traveloregon', 'visitoregon', 'pnwdiscovered', 'pnwadventures', 'oregonexplored', 'hikepnw', 'pnwhikers', 'awesome_earthpix', 'cascadiaexplored', 'hikeoregon', 'exploregon', 'pnwphotographer', 'smithrock', 'earthpix', 'climbing_lovers', 'bendoregon']","9/24/18",2018-09-24 12:25:47,"2018"
"149",726,"['jawdroppingshots', 'jj_oregon', 'outinoregon', 'centraloregon', 'staypnw', 'pnwisbeautiful', 'bestoforegon', 'inbend', 'pnw', 'mthrworld', 'traveloregon', '1natureshot', 'northwestisbest', 'theimaged', 'oregonexplored', 'pnwphotographer', 'wildernessculture', 'westbysouthwest', 'splendid_shotz', 'oregonlove', 'sunsetlovers', 'backyardbend', 'oregonnw', 'compassoutdoors', 'visitbend', 'global_hotshotz', 'natgeoyourshot', 'pnwisbest', 'bendoregon', 'exploreoregon']","9/22/18",2018-09-21 17:02:42,"2018"
"150",400,"['pnwonderland', 'hiking', 'wilderness', 'upperleftusa', 'centraloregon', 'mountain', 'outdoors', 'bestoforegon', 'reflections', 'inbend', 'pnw', 'traveloregon', 'oregon', 'oregonexplored', 'ic_water', 'exploregon', 'trail', 'hike', 'hiker', 'reflection', 'summit', 'bendoregon', 'pacificnorthwest', 'exploreoregon', 'peak']","9/13/18",2018-09-12 22:29:57,"2018"
"151",715,"['oregonbeach', 'pnwonderland', 'hiking', 'liveauthentic', 'oregoncoast', 'PNWlife', 'pnw', 'traveloregon', 'youroregon', 'lifestyle', 'oregon', 'pnwdiscovered', 'naturephotography', 'pnwbyphone', 'mothernature', 'travel', 'oregonexplored', 'naturaloregon', 'cascadiaexplored', 'explore', 'instanature', 'pnwhikes', 'adventure', 'oregonnw', 'nature', 'thenwadventure', 'reflection', 'naturelovers']","7/3/18",2018-07-03 12:33:57,"2018"
"152",3694,"['lonelyplanet', 'livetravelchannel', 'expediapic', 'letsgoeverywhere', 'travelbreak', 'traveldeeper', 'travelphotographer', 'tlpicks', 'traveloregon', 'jucyusa', 'GLT', 'ski', 'wonderful_places', 'skier', 'jetset', 'forbestravelguide', 'jucyworld', 'dailyescape', 'travelstoke', 'dametraveler', 'JUCYxOR', 'skiing', 'weekendfun', 'girlsmeetglobe', 'darlingescapes', 'travelgirl']","5/15/18",2018-05-15 09:14:27,"2018"
"153",1618,"['sendorwhip']","3/19/19",2019-03-19 08:13:21,"2019"
"154",1341,"['beautifulsound', 'exploregon', 'SubaruWinterFest', 'smithrock', 'bendoregon', 'HarmonKardonPartner', 'subaruascent', 'HarmanKardon', 'AD']","3/20/19",2019-03-20 10:23:47,"2019"
"155",461,"['Loves_reflections', 'collectivelynorthwest', 'epic_landscape_', 'pnwphotographer', 'ThisisBend', 'staypnw', 'northwestcreatives', 'backyardbend', 'beautifuloregon', 'beautifuldestinations', 'nature_sultans', 'sonorthwest', 'igshotz', 'northwestisbest', 'earthfocus', 'awesome_earthpix', 'destination', 'pnwcrew', 'oregonstateparks', 'bendoregon', 'earth_magic', 'worldshares', 'wonderfuloregon', 'moodnation', 'worldprime', 'westbysouthwest', 'inbend', 'centraloregon', 'light_brilliance']","3/20/19",2019-03-20 12:06:10,"2019"
"156",403,"['Protectwhatyoulove', 'fly', 'staywild', 'nationalparks', 'bird', 'oregon']","3/19/19",2019-03-19 10:28:40,"2019"
"157",461,"['Loves_reflections', 'collectivelynorthwest', 'epic_landscape_', 'pnwphotographer', 'ThisisBend', 'staypnw', 'northwestcreatives', 'backyardbend', 'beautifuloregon', 'beautifuldestinations', 'nature_sultans', 'sonorthwest', 'igshotz', 'northwestisbest', 'earthfocus', 'awesome_earthpix', 'destination', 'pnwcrew', 'oregonstateparks', 'bendoregon', 'earth_magic', 'worldshares', 'wonderfuloregon', 'moodnation', 'worldprime', 'westbysouthwest', 'inbend', 'centraloregon', 'light_brilliance']","3/20/19",2019-03-20 12:06:10,"2019"
"158",1341,"['beautifulsound', 'exploregon', 'SubaruWinterFest', 'smithrock', 'bendoregon', 'HarmonKardonPartner', 'subaruascent', 'HarmanKardon', 'AD']","3/20/19",2019-03-20 10:23:47,"2019"
"159",403,"['Protectwhatyoulove', 'fly', 'staywild', 'nationalparks', 'bird', 'oregon']","3/19/19",2019-03-19 10:28:40,"2019"
"160",1618,"['sendorwhip']","3/19/19",2019-03-19 08:13:21,"2019"
"161",324,"['whowasthatguy', 'racecars', 'climbers', 'iaintgoingdownlikethat', 'letsraceman', 'muppetgallery', 'speedclimb', 'greenropevsdirtyredone', 'sundayfunday', 'andtheyreoffandracing', 'smithrocklocals', 'climbfast', 'thesharpend', 'smithrock', 'impromptucomp', 'sportscastersbelow']","3/19/19",2019-03-18 18:46:08,"2019"
"162",335,"['copilot', 'huskiesofinstagram', 'anok', 'dogsofinstagram', 'belaypartnersforlife', 'husky', 'silly', 'shelaughs', 'thenilaugh', 'sundayfunday', 'laughfactory', 'climber', 'dogstagram', 'love', 'wolfhybrid', 'dogmom', 'climbing', 'smithrock']","3/18/19",2019-03-17 20:53:58,"2019"
"163",2718,"['flashedit']","3/18/19",2019-03-17 19:47:21,"2019"
"164",402,"['copilot', 'huskiesofinstagram', 'peace', 'smithrocklocals', 'climbing', 'smithrock', 'dogsofinstagram', 'pnw', 'climb', 'grateful', 'nature', 'climbinglife', 'sundayfunday', 'climber', 'dogmom', 'anok', 'huskies', 'cragdog', 'dogstagram', 'wolfhybrid', 'husky']","3/18/19",2019-03-17 17:59:23,"2019"
"165",923,"['pnwonderland', 'travel', 'smithrockstatepark', 'exploreoregon', 'explore', 'adventure', 'oregon']","3/17/19",2019-03-17 12:40:16,"2019"
"166",369,"['copilot', 'climbwhencold', 'skirtsports', 'radgirlslife', 'climb', 'petzl', 'bendoregon', 'gethigh', 'sundayfunday', 'smithrocklocals', 'spring', 'redpointclimbing', 'backyard', 'climber', 'inbend', 'catwoman', 'goodmorning', 'climbing', 'smithrock', 'badasswomen']","3/17/19",2019-03-17 09:56:59,"2019"
"167",2868,"['westcoast', 'cascades', 'roadtrip', 'smithrock', 'outdoors', 'pnw', 'outside', 'bend', 'nature', 'hike', 'lonelyplanet', 'wanderlust', 'oregon', 'beautiful', 'pnwonderland', 'travel', 'neverstopexploring', 'statepark', 'usa', 'mountains', 'adventures', 'explore']","3/17/19",2019-03-17 09:33:03,"2019"
"168",579,"['1']","3/17/19",2019-03-17 08:17:11,"2019"
"169",448,"['inspirationOVERinfluence']","3/15/19",2019-03-15 13:27:20,"2019"
"170",495,"['hikinguniverse']","3/13/19",2019-03-13 07:27:08,"2019"
"171",4253,"['thedarkroomlab']","3/12/19",2019-03-12 11:29:49,"2019"
"172",1611,"['snow']","3/12/19",2019-03-12 09:11:30,"2019"
"173",394,"['keepitwild', 'bendoregonlife', 'outside_project', 'mountainlove', 'bendoregon', 'briskoutdoors', 'outdoorwomen', 'greettheoutdoors', 'wearethewild', 'mountaingirls', 'simplyadventure', 'mountainlife', 'smithrockstatepark', 'wildernessbabes', 'staywildmoonchild']","3/11/19",2019-03-11 16:29:57,"2019"
"174",531,"['pnwisbeautiful', 'thenwadventure', 'discoverearth', 'ourplanetdaily', 'thebestofbend', 'naturegeography', 'oregonnw', 'mountainstones', 'lifeofadventure', 'earthofficial', 'pnwdiscovered', 'globeshotz', 'earth_shotz', 'awesome_earthpix', 'earthfocus', 'nb_nature_brilliance', 'depthsofearth', 'hubs_united', 'jaw_dropping_shots', 'special_shots', 'worldprime', 'ig_shotz_mar19', 'awesome_photographers', 'pnwonderland', 'inbend', 'oregonexplored', 'gottolove_this', 'cascadiaexplored', 'eclectic_shotz', 'nature_perfection']","3/11/19",2019-03-10 17:26:12,"2019"
"175",467,"['liketoknowit']","3/5/19",2019-03-05 12:16:55,"2019"
"176",379,"['foodbusiness', 'startup', 'bendoutdoorworx', 'getoutstayout', 'smallbusiness', 'businessaccelerator', 'mealsforasventuring', 'bend', 'womanowned', 'heatherschoice', 'alaska', 'oregon']","3/5/19",2019-03-05 09:47:37,"2019"
"177",880,"['mytravelmug', '', '', 'giveaway']","3/4/19",2019-03-03 22:30:13,"2019"
"178",739,"['oregonweddingphotographer', 'portlandphotographer', 'indiewedding', 'oregonelopementphotographer', 'oregonelopement', 'sandiegoweddingphotographer', 'seattleweddingphotographer', 'oregonbride', 'bohobride', 'hawaiiphotographer', 'junebugweddings', 'desertwedding', 'bohowedding', 'intimatewedding', 'elopementphotographer', 'mexicoweddingphotographer', 'losangelesphotographer', 'indiebride', 'oregonphotographer', 'elopement', 'washingtonweddingphotographer', 'wedphotoinspiration', 'laphotographer', 'greenweddingshoes', 'seattlephotographer', 'pnwedding', 'californiaweddingphotographer', 'hawaiiweddingphotographer', 'californiaphotographer', 'portlandweddingphotographer']","2/27/19",2019-02-27 10:46:06,"2019"
"179",501,"['travelphotographer', 'rvlife', 'cattleranch', 'bendoregon', 'travelphotography', 'wanderesslcs', 'ranchlife', 'oregonisbeautiful', 'rvadventures', 'roadtrippin', 'smithrockstatepark', 'traveltrailerlife', 'heycow', 'oregon', 'scottishhighland']","2/27/19",2019-02-26 17:28:36,"2019"
"180",601,"['diversifyoutdoors', 'latergram', 'optoutside', 'lasportiva', 'womenonlead', 'chaseyourgoat', 'roadtrip', 'moodygrams', 'rockclimbing', 'love', 'rcwambassador', 'adventure', 'climbing', 'climb', 'smith', 'lifeofadventure', 'nature', 'hustle', 'rockclimbingwomen', 'capture', 'summer', 'mynextadventure', 'adventuretime', 'oregon', 'rcw', 'passion', 'throwback', 'exploremore', 'neverstopexploring', 'explore']","2/27/19",2019-02-26 16:51:17,"2019"
"181",2425,"['oregonofcourse', 'rawandpure', 'somanyfavorites', 'wildlyrefreshing', 'smithrockstatepark']","2/26/19",2019-02-25 16:45:41,"2019"
"182",349,"['lucky']","2/23/19",2019-02-23 14:45:53,"2019"
"183",693,"['ultratraining', 'optoutside', 'ultramarathon', 'run50k', 'smithrockascent', 'smithrock', 'runnerlife', 'pacnw', 'sonya9', 'racephotography', 'runningmotivation', 'sonyalpha', 'trailrunning', 'runnersofinstagram']","2/21/19",2019-02-20 20:05:22,"2019"
"184",508,"['oregonweddingphotographer', 'portlandphotographer', 'indiewedding', 'oregonelopementphotographer', 'oregonelopement', 'sandiegoweddingphotographer', 'seattleweddingphotographer', 'oregonbride', 'bohobride', 'hawaiiphotographer', 'junebugweddings', 'desertwedding', 'bohowedding', 'intimatewedding', 'elopementphotographer', 'mexicoweddingphotographer', 'losangelesphotographer', 'indiebride', 'oregonphotographer', 'elopement', 'washingtonweddingphotographer', 'wedphotoinspiration', 'laphotographer', 'greenweddingshoes', 'seattlephotographer', 'pnwedding', 'californiaweddingphotographer', 'hawaiiweddingphotographer', 'californiaphotographer', 'portlandweddingphotographer']","2/18/19",2019-02-18 10:33:06,"2019"
"185",361,"['adventurepups', 'pnw', 'smithrock', 'germanshepherd', 'upperleft', 'gsd', 'oregon']","2/17/19",2019-02-17 11:53:47,"2019"
"186",8311,"['firecooking', 'camping', 'cook', 'foodie', 'outdoorcooking', 'eatingfortheinsta', 'bacon', 'instafoods', 'braii', 'outdoorgrilling', 'hike', 'goodeats', 'igtravel', 'asado', 'fire', 'oregon', 'scenery', 'travel', 'instafood', 'dinnerideas', 'ramchet', 'forthewin', 'foodiegram', 'instapassport']","2/17/19",2019-02-17 10:23:45,"2019"
"187",1164,"['optoutside', 'theNWadventure', 'exploretocreate', 'passionpassport', 'REI1440project', 'idaho', 'picoftheday', 'adventure', 'featuremeinstagood', 'naturelovers', 'agameoftones', 'beautifuldestinations', 'liveauthentic', 'travelstoke', 'lifeofadventure', 'nature', 'canada', 'northwestisbest', 'bleachmyfilm', 'wildernessculture', 'photooftheday', 'oregon', 'wanderlust', 'justgoshoot', 'peoplescreatives', 'instagood', 'washington', 'neverstopexploring', 'explore', 'PNW']","2/16/19",2019-02-16 13:30:36,"2019"
"188",393,"['agameoftones', 'theadventurehandbook', 'moodygrams', 'pnwonderland', 'oregonexplored', 'lifeofadventure', 'imaginarymagnitude']","2/15/19",2019-02-15 15:22:50,"2019"
"189",2597,"['climbersonlydotcom']","2/12/19",2019-02-12 08:15:41,"2019"
"190",6980,"['pnwonderland']","2/8/19",2019-02-08 15:00:32,"2019"
"191",360,"['chalkmatters']","2/8/19",2019-02-07 22:30:18,"2019"
"192",464,"['smithrockstatepark', 'bend', 'smithrock', 'oregon']","2/6/19",2019-02-06 09:37:20,"2019"
"193",1482,"['australianshepherdworld', 'dogsthathike', 'puppy', 'giveaussieslove', 'puppiesofinstagram', 'smithrockstatepark', 'whatthefluffchallenge', 'gotchaday', 'bestwoof', 'whpcolorwheel', 'instaaussie', 'pup', 'weeklyfluff', 'bestbuds', 'hikingadventures', 'dogswhohike', 'hikingwithdogs', 'besties', 'pnwonderland', 'pnwwonderdogs', 'australianshepherd', 'hikingdogsofinsta', 'aussiesdoingthings']","2/2/19",2019-02-02 15:46:22,"2019"
"194",611,"['destinationpnw']","2/2/19",2019-02-01 19:43:25,"2019"
"195",350,"['dobermaninfinity', 'dogsthathike', 'dobermansofig', 'alldoberman', 'dobermanlove', 'smithrock', 'doberman', 'pnw', 'dobermanpinscher', 'dobermans', 'dobermanpuppy', 'fox12oregon', 'dobermansofinstagram', 'instagram', 'dobermann', 'pdx', 'pnwonderdogs', 'pnwhiking', 'doberman_pinschers', 'dogsthatexplore', 'oregon', 'dobermanpride', 'pnwonderland', 'dobelove', 'pnwlife', 'foxnews', 'reddoberman']","1/31/19",2019-01-30 20:18:41,"2019"
"196",345,"['climbingtrees', 'climbingtrip', 'climbinggirl']","1/30/19",2019-01-29 22:00:24,"2019"
"197",386,"['alwaysbethankful', 'recoverystrong', 'letyourfeethittheground', 'livethatlife']","1/28/19",2019-01-28 04:00:46,"2019"
"198",558,"['dogsthathike', 'dobermansofig', 'dobermanofinstagram', 'alldoberman', 'smithrockstatepark', 'dobermanlove', 'dogsofinstaworld', 'gsdloverss', 'doberman', 'dobermanpinscher', 'dobermans', 'gsdunited', 'dobermanpuppy', 'germanshepherd', 'gsdpuppy', 'dobermansofinstagram', 'dobermann', 'germanshepherdpuppy', 'doberman_pinschers', 'gsd', 'oregon', 'gsddaily', 'dobermanpride', 'pnwonderland', 'dobelove', 'gsdofinstagram']","1/28/19",2019-01-27 19:38:38,"2019"
"199",420,"['yikes', 'wheninCO']","1/27/19",2019-01-26 17:58:59,"2019"
"200",391,"['retrospective', 'newbook']","1/26/19",2019-01-26 15:00:19,"2019"
"201",1057,"['sponsored', 'nobadweather']","1/25/19",2019-01-25 12:46:46,"2019"
"202",667,"['runnerslife', 'runningmotivation', 'ultratraining', 'optoutside', 'throwbackthursday', 'tbt', 'sonya9', 'womenofultrarunning', 'ultramarathon', 'trailrunning', 'badasswomen']","1/24/19",2019-01-24 15:58:30,"2019"
"203",1752,"['upperleftliving', 'exploregon', 'smithrock', 'rockclimbing']","1/24/19",2019-01-23 19:26:52,"2019"
"204",641,"['soontobeoregonian']","1/24/19",2019-01-23 18:42:28,"2019"
"205",348,"['riyets', 'kgwweather', 'moodygrams', 'pnwwonderland', 'ig_landscape', 'smithrock', 'nature_globepix', 'loves_landscapes', 'jj_oregon', 'team_canon', 'colors_of_day3', 'globalcapture', 'pnwdiscovered', 'pnw_compass', 'earthfocus', 'pnwcrew', 'earth_shotz', 'pocket_allnature', 'hello_worldpics', 'artofvisuals', 'moodynature', 'ig_unitedstates_', 'worldprime', 'IdRatherBeInNature', 'instagood', 'oregonexplored', 'everything_imaginable', 'mountains', 'exceptional_pictures', 'cascadiaexplored']","1/23/19",2019-01-23 15:56:46,"2019"
"206",5828,"['findyourpark', 'radparks']","1/23/19",2019-01-23 11:19:54,"2019"
"207",379,"['runnerslife', 'runningmotivation', 'optoutside', 'smithrockascent', 'run50k', 'sonya9', 'ultramarathon', 'adventuretime', 'trailrunning']","1/23/19",2019-01-23 07:58:28,"2019"
"208",4854,"['iphoneographer']","1/22/19",2019-01-22 12:39:00,"2019"
"209",2181,"['sponsored', 'visitbend']","1/22/19",2019-01-21 18:07:24,"2019"
"210",819,"['portlandlife', 'portlandtodo', 'cityofportland', 'igersportland', 'portlandnow', 'roamtheplanet', 'portland', 'passionpassport', 'wonderlustportland', 'portlandblogger', 'onlyportland', 'visitportland', 'unitedstates', 'wonderlust', 'theglobewanderer', 'usa', 'wonderlustmagazine', 'portlandcity']","1/18/19",2019-01-17 20:42:10,"2019"
"211",561,"['earthoutdoors10k']","1/17/19",2019-01-17 13:59:55,"2019"
"212",6918,"['pnwonderland']","1/16/19",2019-01-16 10:20:31,"2019"
"213",6079,"['ParksForAll', 'WeLoveOurParks', 'HeyLetsGo']","1/15/19",2019-01-14 18:59:55,"2019"
"214",496,"['mastinlabs', 'smithrock', 'portra', 'elopement']","1/14/19",2019-01-14 14:05:26,"2019"
"215",650,"['80sclimbing', 'climb', 'climbingzine', 'rockclimbing', 'sportclimbing', 'climbing_photos_of_instagram', 'climbingtraining', 'climbing', 'smithrock', 'oldschoolclimbing']","1/13/19",2019-01-13 08:24:59,"2019"
"216",418,"['roadtrip', 'doginacar', 'hikingdogsofinstagram', 'oregonexplored', 'pnwdogs', 'rememberingEmma', 'goforaride', 'smithrock', 'EmmasGrandAdventure']","1/12/19",2019-01-12 15:31:50,"2019"
"217",2473,"['FreudianSlip', 'Woops']","1/12/19",2019-01-12 15:16:11,"2019"
"218",838,"['yosemitephotographer', 'sedonaweddingphotographer', 'bendoregonweddingphotographer', 'nationalparkelopement', 'sedonaelopement', 'arizonaelopement', 'rockymountainnationalpark', 'idahowedding', 'seattleweddingphotographer', 'coloradoelopementphotographer', 'pnwweddingphotographer', 'arizonaweddingphotographer', 'wyomingelopement', 'washingtonelopement', 'coloradoelopement', 'washingtonweddingphotographer', 'bendoregon', 'sydneemariephoto', 'washingtonwedding', 'bostonweddingphotographer', 'coloradoweddingphotographer', 'bendoregonphotographer', 'denverweddingphotographer', 'yosemitewedding', 'tacomaweddingphotographer', 'yosemiteelopement', 'pnwonderland', 'pnwlife']","1/12/19",2019-01-12 11:22:29,"2019"
"219",1273,"['timetoplay', 'guforit', 'trailrunning']","1/12/19",2019-01-11 21:17:30,"2019"
"220",821,"['pawz', 'hikingdogsofinstagram', 'whpinspiredby', 'thegreatoutdogs', 'pupfluencer', 'bulldogsofinstagram', 'aestheticdogs', 'moodygram', 'thedodo', 'mydogist', 'offleashed', 'thestatelyhound', 'GetAfterIt', 'boxersofinstagram', 'dogsofpnw', 'bestwoof', 'adventuremutt', 'bark', 'weeklyfluff', 'FeistyFriday', 'freyatheboxer', 'dogsonadventures', 'dogoftheday', 'campingwithdogs', 'dogsofbend', 'ItsFridayNightAndImFeelinAlright', 'friday', 'thedailyboxer', 'stayfly']","1/12/19",2019-01-11 19:14:50,"2019"
"221",931,"['MomentOffsite']","1/11/19",2019-01-10 22:41:09,"2019"
"222",1232,"['diversifyoutdoors', 'latergram', 'optoutside', 'lasportiva', 'womenonlead', 'chaseyourgoat', 'roadtrip', 'moodygrams', 'rockclimbing', 'love', 'rcwambassador', 'adventure', 'climbing', 'climb', 'smith', 'lifeofadventure', 'nature', 'rockclimbingwomen', 'capture', 'mynextadventure', 'adventuretime', 'oregon', 'rcw', 'passion', 'throwback', 'exploremore', 'neverstopexploring', 'explore']","1/9/19",2019-01-09 04:44:18,"2019"
"223",1097,"['rcw', 'womenwhoclimb', 'inspiration', 'RCWAmbassador', 'powerofshe', 'smithrockstatepark', 'womenempowerment', 'rcwambassador', 'rockclimbingwomen']","1/8/19",2019-01-07 20:16:08,"2019"
"224",843,"['pawz', 'lensbible', 'hikingdogsofinstagram', 'thegreatoutdogs', 'pupfluencer', 'bulldogsofinstagram', 'aestheticdogs', 'KweenFrey', 'thedodo', 'mydogist', 'offleashed', 'thestatelyhound', 'winterishere', 'whpunexpected', 'boxersofinstagram', 'dogsofpnw', 'bestwoof', 'adventuremutt', 'bark', 'BowDownYouDogs', 'weeklyfluff', 'smithsrock', 'freyatheboxer', 'dogsonadventures', 'dogoftheday', 'campingwithdogs', 'instagramdogs', 'BeABoss', 'thedailyboxer']","1/4/19",2019-01-04 15:05:37,"2019"
"225",600,"['exploreourearth', 'awesomeearth', 'bevisuallyinspired', 'theearthoutdoors', 'visualscollective', 'exploretocreate', 'kokopelli', 'travelpioneer', 'captureyourcreativity', 'voyaged', 'thebestofbend', 'beautifuldestinations', 'lifeofadventure', 'travelstoke', 'earthfocus', 'natgeoyourshot', 'folkgood', 'ourcamplife', 'visitbend', 'packrafting', 'bbconlocation', 'createexplore', 'adventureanywhere', 'bealpha', 'oregonexplored', 'goatworthy']","1/4/19",2019-01-03 19:25:09,"2019"
"226",451,"['smithrock', 'oregon']","1/3/19",2019-01-03 10:36:44,"2019"
"227",1072,"['oregonlife', 'pnwisbeautiful', 'optoutside', 'girlswhohike', 'pnwadventures', 'smithrockstatepark', 'ourpnw', 'thatpnwlife', 'smithrock', 'alpineadventures', 'upperleftusa', 'landscapephotography', 'pnwisbest', 'winterhiking', 'mountaintherapy', 'exploregon', 'themountainsarecalling', 'oregonlove', 'worldnomads', 'mountainadventures', 'backcountrybabes', 'choosemountains', 'dirtbagdarling', 'pnwonderland', 'pnwoutdoorwomen', 'adventurestartshere', 'oregonexplored', 'sheadventures', 'cascadiaexplored', 'pnwcollective']","1/3/19",2019-01-02 22:10:46,"2019"
"228",369,"['hiking', 'theNWadventure', 'rockclimbing', 'pnwwonderland', 'ig_shotz', 'ig_landscape', 'smithrock', 'shotz_times', 'nature_globepix', 'outdoors', 'stateparks', 'jj_oregon', 'globalcapture', 'pnwdiscovered', 'nature', 'pnw_compass', 'earthfocus', 'earth_shotz', 'hello_worldpics', 'ig_unitedstates_', 'oregon', 'worldprime', 'instagood', 'westcoast_exposures', 'oregonexplored', 'everything_imaginable', 'mountains', 'exceptional_pictures', 'cascadiaexplored', 'pnwcollective']","1/3/19",2019-01-02 20:49:39,"2019"
"229",955,"['pawz', '2019', 'hikingdogsofinstagram', 'thegreatoutdogs', 'pupfluencer', 'bulldogsofinstagram', 'aestheticdogs', 'thedodo', 'mydogist', 'offleashed', 'thestatelyhound', 'boxersofinstagram', 'dogsofpnw', 'bestwoof', 'happynewyears', 'bark', 'weeklyfluff', 'freyatheboxer', 'dogsofbark', 'CantStopWontStop', 'dogsonadventures', 'WHPresolution', 'dogoftheday', 'campingwithdogs', 'instagramdogs', 'thedailyboxer', 'resolution']","1/2/19",2019-01-01 17:11:34,"2019"
"230",579,"['optoutside', 'lululemonaddict', 'yogaflow', 'thisisyoga', 'smithrock', 'lululemon', 'yogaforathletes', 'skyrunner', 'yogaeverydamnday', 'yogafun', 'yogadaily', 'plank', 'yogajunkey', 'yogachallenge', 'yogajourney', 'yogastrong', 'yogalife', 'yogaoutside', 'yoga', 'barre3', 'barre3anywhere', 'dirtbagdarling', 'planks', 'yogainspiration', 'yogafitness', 'yogafit', 'pnwlove', 'namasday', 'plankchallenge', 'thesweatlife']","12/31/18",2018-12-31 10:01:51,"2018"
"231",1229,"['running', 'mottooftheday', 'beaststc', 'migrating']","12/30/18",2018-12-29 17:40:52,"2018"
"232",3097,"['highlightsof2018']","12/29/18",2018-12-29 03:33:27,"2018"
"233",356,"['oregonlife', 'smithrockstatepark', 'smithrock', 'beardlove', 'exploreoregon', 'pnw', 'beardlife', 'bearded', 'beard', 'beardedman', 'fbf', 'beardlovers', 'thirty8art', 'beardgang', 'beardedmen', 'flashbackfriday', 'pacificnorthwest', 'beardlover', 'oregon', 'beardedlife', 'beardsofinstagram', 'flashback', 'beardedvillains', 'beards', 'beardstyle', 'oregonexplored', 'centraloregon', 'beardedforherpleasure', 'beardedlifestyle']","12/28/18",2018-12-28 11:31:31,"2018"
"234",5584,"['giveback', 'climbingphotography', 'monkeyface', 'goclimb', 'smithrockstatepark', 'stonemountainsbook']","12/24/18",2018-12-24 10:00:27,"2018"
"235",3040,"['liveclimbrepeat']","12/24/18",2018-12-24 09:00:22,"2018"
"236",488,"['spartanba18', 'hoinvincible4']","12/24/18",2018-12-24 06:25:21,"2018"
"237",1224,"['onsight', 'adamondra', 'sportclimbing', 'oregon', 'smithrockstatepark', 'climbinghistory', 'smithrock']","12/23/18",2018-12-23 08:44:50,"2018"
"238",353,"['rockclimb', 'moodygrams', 'exploretocreate', 'theoutbound', 'ourplanetdaily', 'sonyvisuals', 'smithrock', 'vscox', 'wethecreators', 'vscocollective', 'themoderndayexplorer', 'aov', 'agameof10k', 'sonyalpha', 'vscocam', 'gurushots', 'alphacollective', 'visitoregon', 'thevisualscollective', 'traveler', '777luckyfish', 'A7RIII', 'oregon', 'doyoutravel', 'A7R3', 'IFonlyweshoot', 'aollco']","12/23/18",2018-12-22 21:14:29,"2018"
"239",1047,"['timetoplay', 'backyardbend']","12/23/18",2018-12-22 18:25:43,"2018"
"240",518,"['runoregon', 'corredordemontaa', 'bendbanditos', 'mountainday', 'trailrunning']","12/23/18",2018-12-22 17:33:10,"2018"
"241",527,"['fall', 'smithrockstatepark', 'pnwphotographer', 'adventure', 'blueskies', 'braid', 'smithrock', 'desert', 'pdxphotographer', 'october', 'model', 'pdxmodel', 'traveling', 'photography', 'braidedhair', 'blueeyes', 'blonde', 'oregon', 'throwback', 'flannel', 'tan', 'curvygirl', 'pnwmodel', 'photoshoot', 'cold', 'heels']","12/21/18",2018-12-21 15:33:07,"2018"
"242",1009,"['liveclimbrepeat', 'screamlikeondra']","12/21/18",2018-12-21 09:39:11,"2018"
"243",11267,"['liveclimbrepeat', 'screamlikeondra']","12/21/18",2018-12-21 07:56:19,"2018"
"244",619,"['summitoverlandca', 'roadtrip', 'familyvacation', 'smithrockstatepark', 'bucketlist', 'nofilter', 'overland', 'adventure', 'oregon', 'bringbacksummer', 'turtlebacktrailers']","12/21/18",2018-12-20 18:56:16,"2018"
"245",7891,"['', 'smithrockstatepark', 'rockclimbing']","12/20/18",2018-12-20 13:58:10,"2018"
"246",472,"['hikelife', 'camping', 'landscape_lover', 'instatravel', 'greenlife', 'explorenature', 'naturelovers', 'lake', 'sky', 'hikeaz', 'landscapephotography', 'hikinglife', 'mothernature', 'hikers', 'earth', 'womenwhohike', 'instago', 'sun', 'hikerlife', 'tourist', 'travel', 'liveoutside', 'mountains', 'instatraveling', 'hikes', 'hikingadventures']","12/20/18",2018-12-20 09:39:21,"2018"
"247",515,"['earthoutdoors10k']","12/19/18",2018-12-19 12:48:19,"2018"
"248",934,"['westcoast', 'optoutside', 'unrulydreamers', 'hiking', 'dailyhivevan', 'rockclimbing', 'pnwwonderland', 'kungfu', 'adventure', 'livefolk', 'exploreoregon', 'climbing', 'smithrock', 'outdoors', 'agameoftones', 'pnw', 'upperleftusa', 'alpinebabes', 'girlswhoclimb', 'happyadventuring', 'goodtimesoutside', 'photography', 'rei', 'pnwcollective', 'wanderlust', 'climberlife', 'herpnwlife', 'getoutside', 'sheadventures', 'expandyourplayground']","12/19/18",2018-12-19 07:56:58,"2018"
"249",337,"['everytrailconnects', 'pnwwonderland', 'thisisyoga', 'outsideisfree', 'likeamountaingirl', 'smithrock', 'lululemon', 'mountaingoat', 'publicland', 'nationalparks', 'teenytinytuesday', 'findyourpark', 'nationalpark', 'nationalparksusa', 'nationalparkservice', 'adventuretime', 'yoga', 'backcountry', 'trailrunning', 'optoutdoors', 'nationalparksadventure', 'womenwhoexplore', 'forceofnature', 'timetoplay', 'sweatcollective', 'getoutside', 'pnwlife', 'publiclands', 'goatworthy']","12/19/18",2018-12-18 17:51:57,"2018"
"250",392,"['teamevolv', 'wearerab', 'themountainpeople', 'petzlgram']","12/18/18",2018-12-18 08:18:58,"2018"
"251",1272,"['TILD']","12/17/18",2018-12-17 10:38:27,"2018"
"252",533,"['climbingisbliss', 'climbing', 'womenonlead', 'climbingaddict', 'flashfoxy', 'WaWomenCragClimbers', 'climbgirls', 'RCWAmbassador', 'climblikeagirl', 'girlonrockrockongirl', 'powerofshe', 'girlswhoclimb', 'womenempowerment', 'climbergirl', 'sendit', 'rockclimbingwomen']","12/17/18",2018-12-17 08:25:54,"2018"
"253",548,"['grassland', 'rocks', 'smithrockstatepark', 'happy', 'pnwphotographer', 'smithrock', 'pnw', 'hats', 'pdxmodel', 'throwbacktooctober', 'pnwphotography', 'photography', 'pdx', 'blondehair', 'blueeyes', 'longhair', 'oregon', 'content', 'windy', 'tan', 'bluesky', 'beauty', 'pnwmodel', 'heels']","12/17/18",2018-12-16 18:16:06,"2018"
"254",422,"['westcoast', 'westcoastisthebestcoast', 'hiking', 'adventuring', 'smithrockstatepark', 'natureismytherapy', 'smithrock', 'westcoastlife', 'outdoors', 'pnw', 'hikingislife', 'fall2018', 'nature', 'hikingismytherapy', 'hikingismypassion', 'naturelover', 'oregon', 'hikingaddict', 'pnwonderland', 'getoutside', 'neverstopexploring', 'oregonexplored', 'hikingday', 'explore', 'hikingadventures']","12/16/18",2018-12-15 18:37:57,"2018"
"255",355,"['oregonstateparks', 'sky_painters', 'jj_oregon', 'twilight', 'nature_skyshotz', 'sky_love', 'centraloregon', 'smithrockstatepark', 'sky_collection', 'nature_lovers', 'oregon', 'nature_shooters']","12/13/18",2018-12-12 20:38:39,"2018"
"256",NA,NA,NA,NA,NA
"257",3880,"['adventurefamily', 'smithrockstatepark']","12/11/18",2018-12-11 09:44:41,"2018"
"258",452,"['earthoutdoors10k']","12/10/18",2018-12-10 13:18:45,"2018"
"259",353,"['ikershaw', 'smithrockstatepark']","12/10/18",2018-12-10 07:47:10,"2018"
"260",678,"['pnwparadise', 'jj_nature', 'pnwisbeautiful', 'climbing', 'jj_oregon', 'pnwonderland', 'jj_westcoast', 'bestoforegon', 'oregonisbeautiful', 'oregonexplored', 'centraloregon', 'pnwdiscovered', 'smithrockstatepark', 'destinationpnw', 'youroregon', 'thebestofbend', 'cascadiaexplored', 'oregon', 'pnwcollective']","12/9/18",2018-12-09 07:56:58,"2018"
"261",7034,"['STiOMG', 'NyiNZawPhotography']","12/8/18",2018-12-08 15:38:16,"2018"
"262",386,"['optoutside', 'outdoor', 'climbingwalls', 'vibes', 'picoftheday', 'quotes', 'boricua', 'photoftheday', 'Sports', 'Oregon', 'Journey', 'Viajero', 'travelblogger', 'ClimbingTrip', 'outdoorsports', 'onestarindustries', 'livsn', 'climber', 'Climbing', 'islandboy', 'travel', 'Adventure', 'keepwhatmatters', 'Trip', 'IsabelinoEnElMundo', 'sportclimbing', 'Vive', 'wisely', 'goatworthy']","12/8/18",2018-12-08 10:47:46,"2018"
"263",323,"['pnwisbeautiful', 'thatoregonlife', 'onlyinoregon', 'collectivelynorthwest', 'naturalunited', 'thenwadventure', 'thebestofbend', 'ourplanetdaily', 'oregonnw', 'jj_oregon', 'thisisbend', 'upperleftusa', 'bestoforegon', 'pnwdiscovered', 'whpnaturallight', 'pnwcrew', 'pnwparadise', 'upperleftliving', 'pnwadventurers', 'oregonisbeautiful', 'pnwuncovered', 'visitbend', 'pnwadventuresquad', 'roam247', 'westbysouthwest', 'pnwonderland', 'oregonexplored', 'northwestexplored', 'cascadiaexplored', 'nature_perfection']","12/7/18",2018-12-07 11:47:05,"2018"
"264",1338,"['smithrock']","12/7/18",2018-12-07 10:51:48,"2018"
"265",594,"['bestoforegon', 'bestofcentraloregon', 'bestofbend', 'ig_shotz', 'jawdroppingshots']","12/7/18",2018-12-07 10:33:34,"2018"
"266",418,"['visualambassadors', 'awesomeearth', 'royalsnappingartists', 'greatnorthcollective', 'natureaddict', 'Inbend', 'thatpnwlife', 'VisualsOfLife', 'pnw', 'folkcreative', 'MoodyGrams', 'upperleftusa', 'northwestcreatives', 'exklusive_shot', 'instanaturelover', 'artofvisuals', 'bendoregon', 'createcommune', 'rsa_rural', 'landscape_captures', 'theimaged', 'visitbend', 'sombresociety', 'nature_wizards', 'peoplescreatives', 'fatalframes', 'pnwonderland', 'gearednomad', 'nature_perfection']","12/7/18",2018-12-06 19:36:35,"2018"
"267",1045,"['awesomeearth', 'hiking', 'getoutstayout', 'theoutbound', 'naturephotography', 'smithrockstatepark', 'lifewelltraveled', 'conservationalliance', 'visualsoflife', 'stayadventurous', 'naturelovers', 'outdoorlife', 'earth_shots', 'exploreeverything', 'journey', 'beautifuldestinations', 'lifeofadventure', 'liveauthentic', 'mountainlife', 'idhikethatcrew', 'earthfocus', 'idratherbeinnature', 'artofvisuals', 'explorer', 'idhikethat', 'liveyouradventure', 'amazingplaces', 'pnwonderland', 'gooutsideandplay', 'hikingadventures']","12/6/18",2018-12-06 10:00:33,"2018"
"268",1258,"['STiOMG', 'NyiNZawPhotography']","12/6/18",2018-12-05 17:52:04,"2018"
"269",884,"['igrunners', 'runitfast', 'stravarun', 'beyoubeactive', 'marathon', 'iloverunning', 'bend', 'runsteepgethigh', 'runningmotivation', 'courir', 'runnersofinstagram', 'runnerslife', 'irun4ultra', 'oregon', 'wanderlust', 'adventurelife', 'humansofultrarunning', 'ultrarunning', 'ultrarunner', 'findyourstrong', 'runnerscommunity', 'AthletesUnfiltered', 'correr', 'inspiredbyathletes', 'goatworthy']","12/4/18",2018-12-04 08:06:51,"2018"
"270",626,"['pressspacebartocontinue']","12/1/18",2018-12-01 08:00:35,"2018"
"271",6056,"['STiOMG', 'NyiNZawPhotography']","11/30/18",2018-11-29 16:04:15,"2018"
"272",612,"['centraloregon', 'smithrockstatepark', 'hiking']","11/26/18",2018-11-26 14:26:55,"2018"
"273",629,"['exploremore', 'oregon']","11/26/18",2018-11-26 07:37:23,"2018"
"274",947,"['visualambassadors', 'moodygrams', 'amazing_longexpo', 'night_shooterz', 'visualsoflife', 'capture4cubes', 'longexposure_shots', 'milkyway', 'way2ill', 'heatercentral', 'nightscaper', 'earth_shotz', 'earthfocus', 'depthsofearth', 'createcommune', 'longexpoelite', 'theimaged', 'night_excl', 'shotzdelight', 'ig_color', 'fatalframes', 'nightimages', 'nightphotography', 'illgrammers', 'longexpo_addiction', 'eclectic_shotz']","11/26/18",2018-11-25 18:37:39,"2018"
"275",560,"['naturepunx', 'gooutside']","11/25/18",2018-11-25 15:05:30,"2018"
"276",332,"['iloveoregon', 'optoutside', 'smithrockstatepark']","11/25/18",2018-11-24 16:53:22,"2018"
"277",434,"['jucyxor']","11/23/18",2018-11-23 15:12:05,"2018"
"278",638,"['oregonlife', 'optoutside', 'roamersworld', 'getoutstayout', 'globecouples', 'smithrockstatepark', 'thenwadventure', 'travelcouples', 'pnwroamers', 'upperleftusa', 'couplegoals', 'pnwdiscovered', 'youroregon', 'thegreatoutdoors', 'wildnernessculture', 'outdoortones', 'adventureculture', 'pnwhiking', 'visitbend', 'conquerOregon', 'usaprimeshot', 'hikingwithdogs', 'pacificnorthwest', 'hikingculture', 'herpnwlife', 'pnwonderland', 'discoveroregon', 'pnwlife', 'cascadiaexplored', 'pnwcollective']","11/22/18",2018-11-21 18:49:00,"2018"
"279",2552,"['mountainlovers', 'optoutside', 'hiking', 'welivetoexplore', 'stayadventurous', 'findmeoutside', 'earth_shots', 'splendid_mountains', 'idhikethatcrew', 'hikinglife', 'adventureenthusiast', 'goneoutdoors', 'thegreatoutdoors', 'idratherbeinnature', 'seekingadventure', 'adventureawaits', 'artofvisuals', 'adventureculture', 'idhikethat', 'visualsofearth', 'hikingtheglobe', 'hikingaddict', 'exploremore', 'staywild', 'peoplewhohike', 'gooutsideandplay']","11/22/18",2018-11-21 18:01:34,"2018"
"280",599,"['introvertlife']","11/20/18",2018-11-20 07:50:19,"2018"
"281",367,"['oregonstateparks', 'rideoregon', 'leftie', 'adventurecycling', 'bespoke', 'getoutside', 'singlespeed', 'itsallyours', 'smithrockstatepark', 'semifat', 'publiclands']","11/19/18",2018-11-18 22:35:41,"2018"
"282",389,"['crackclimbing', 'success', 'norest', 'coldAF', 'climber', 'cantstopwhenyouretired', 'gruntyourwaythroughit', 'climbergirljewelry', 'tradisrad', 'climbing', 'smithrock']","11/19/18",2018-11-18 16:58:44,"2018"
"283",352,"['copilot', 'radgirlslife', 'wolveswhoclimb', 'sundayfunday', 'climber', 'climbingdogs', 'climbing', 'smithrock', 'badasswomen']","11/18/18",2018-11-18 11:10:28,"2018"
"284",494,"['ThrowbackThursday']","11/16/18",2018-11-15 20:03:46,"2018"
"285",470,"['birdsbybijs']","11/16/18",2018-11-15 18:27:15,"2018"
"286",386,"['birdsbybijs']","11/15/18",2018-11-15 06:23:54,"2018"
"287",395,"['dpsambassador', 'amga1979', 'smithrock', 'ifmga']","11/15/18",2018-11-14 20:21:04,"2018"
"288",504,"['hikelife', 'outdoor', 'landscape_lover', 'instatravel', 'tourism', 'explorenature', 'naturelovers', 'lake', 'hikingadventure', 'hikeaz', 'landscapephotography', 'hike', 'traveling', 'igtravel', 'earth', 'womenwhohike', 'hikersofinstagram', 'naturelover', 'liveoutside', 'instatraveling', 'hikes', 'hikingadventures', 'instapassport']","11/13/18",2018-11-13 10:14:15,"2018"
"289",609,"['creativityfound', 'optoutside', 'climbingart', 'artist', 'thatpnwlife', 'exploreoregon', 'smithrock', 'pdxartist', 'creativehappylife', 'portlandartist', 'pnw', 'cultivatecreativity', 'adventureart', 'artistofinstagram', 'oregonartist', 'portlandart', 'createcommune', 'pnwart', 'adventureartist', 'sheexplores', 'forceofnature', 'centraloregonart', 'getoutside', 'oregonexplored', 'artofthepnw', 'portlandmade']","11/13/18",2018-11-13 10:03:50,"2018"
"290",1415,"['themonkeyface', 'smithrockstatepark']","11/13/18",2018-11-13 09:14:04,"2018"
"291",460,"['westcoast', 'optoutside', 'natgeo', 'roamtheplanet', 'hiking', 'theoutbound', 'northwest', 'lonleyplanet', 'ourplanetdaily', 'landscape', 'outdoors', 'pnw', 'upperleftusa', 'earthofficial', 'nature', 'rei', 'wildernessculture', 'discover', 'choosemountains', 'wanderlust', 'beautiful', 'pnwonderland', 'travel', 'rei1440project', 'neverstopexploring', 'getoutside', 'explore', 'cascadiaexplored', 'pnwcollective']","11/13/18",2018-11-13 08:02:17,"2018"
"292",410,"['trailsisters', 'ultramarathon', 'optoutside', 'roadtocim', 'sonyalphagear', 'smithrockascent', 'sonya9', 'trailrunning', 'endurance', 'explore', 'womenofrunning']","11/13/18",2018-11-13 07:33:37,"2018"
"293",613,"['onsight', 'adamondra', 'sportclimbing', 'usaclimbing', 'smithrock', 'onsight_climbing']","11/12/18",2018-11-12 05:07:52,"2018"
"294",334,"['traveltime', 'shotoniphone', 'lensculture', 'keepitwild', 'visualscollective', 'stayandwander', 'artofvisuals', 'pnwonderland', 'getoutstayout', 'passionpassport', 'russicaslim', 'instanature', 'portlandnw', 'liveoutdoors']","11/12/18",2018-11-11 19:08:50,"2018"
"295",1142,"['BePrepared']","11/11/18",2018-11-11 15:33:13,"2018"
"296",1542,"['smithrockstatepark']","11/11/18",2018-11-11 13:22:21,"2018"
"297",539,"['dogisgood', 'pictureoftheday', 'hikingdogsofinstagram', 'dogsthathike', 'thegreatoutdogs', 'dogsofinstaworld', 'aestheticdogs', 'adventure', 'exploreoregon', 'smithrock', 'dailypawwoof', 'dog_features', 'pnw', 'thenorthwestdog', 'outwardhound', 'bestwoof', 'instagram', 'dailypawprints', 'wildernessculture', 'pnwonderdogs', 'totallypawsomepups', 'ruffbar', 'oregon', 'tuffpupper', 'dogsonadventures', 'thedailyshibainu', 'pnwonderland', 'terrebonne', 'oregonexplored', 'shibainu']","11/10/18",2018-11-09 18:23:45,"2018"
"298",1340,"['rockdiscrete']","11/8/18",2018-11-08 15:45:25,"2018"
"299",541,"['nails', 'smithrockstatepark', 'grasslands', 'happy', 'pnwphotographer', 'smithrock', 'rippedjeans', 'pdxphotographer', 'wind', 'model', 'pdxmodel', 'deadtree', 'photography', 'tattoos', 'blondehair', 'warm', 'blueeyes', 'sweater', 'photographer', 'booty', 'sunny', 'content', 'tattoo', 'beautiful', 'hat', 'tan', 'oregonmodel', 'pnwmodel', 'heels']","11/8/18",2018-11-08 13:42:27,"2018"
"300",4554,"['OttoTheAdventurePup']","11/8/18",2018-11-08 12:34:36,"2018"
"301",477,"['CraftBeer', 'CraftBeerAcrobat', 'Beertography', 'BarleyBrownsBeer', 'ArtInspiresArt', 'InBend', 'BendBrewDaddy', 'JuniperTree', 'SmithRockStatePark', 'WestCoastBeerSquad', 'beerphotography', 'IPA', 'Beer', 'SmithRock', 'PalletJack']","11/8/18",2018-11-07 19:07:24,"2018"
"302",448,"['optoutside', 'outdoor', 'climbingwalls', 'vibes', 'discoverearth', 'picoftheday', 'quotes', 'boricua', 'photoftheday', 'Oregon', 'Travelphotography', 'Journey', 'Viajero', 'travelblogger', 'ClimbingTrip', 'outdoorsports', 'onestarindustries', 'livsn', 'Climbing', 'islandboy', 'travel', 'Adventure', 'keepwhatmatters', 'Trip', 'IsabelinoEnElMundo', 'sportclimbing', 'Vive', 'wisely', 'goatworthy']","11/7/18",2018-11-07 14:34:04,"2018"
"303",4564,"['rocks', 'sportclimbing']","11/7/18",2018-11-07 12:09:16,"2018"
"304",12611,"['rockclimb', 'balls', 'highwire']","11/7/18",2018-11-07 04:58:43,"2018"
"305",418,"['climbing', 'smithrockstatepark', 'climbing_is_my_passion']","11/4/18",2018-11-03 23:10:11,"2018"
"306",567,"['grassland', 'bootybootybooty', 'pnwphotographer', 'blueskies', 'smithrock', 'toned', 'desert', 'pdxphotographer', 'model', 'pdxmodel', 'implied', 'photography', 'tattoos', 'blondehair', 'blueeyes', 'jeans', 'oregondesert', 'booty', 'oregon', 'tattoo', 'flannel', 'beautiful', 'day', 'tan', 'pnwmodel']","11/3/18",2018-11-03 15:07:14,"2018"
"307",331,"['belovedstories', 'pnwelopement', 'goldenhourphotographer', 'goldenhourlove', 'adventurousphotographer', 'elopementlove', 'dirtybootsandmessyhair', 'couplesphotographer', 'pnwphotographer', 'adventurousstorytellers', 'creativetravelcouples', 'pdxphotographer', 'warmradandfree', 'bendphotographer', 'elopementphotographer', 'muchlove_ig', 'oregonphotographer', 'engagementphotography', 'epicloveepiclife', 'radlovestories', 'adventurouslovestories', 'sweetgoldenhour', 'oarsandbeanies', 'loveandwildhearts', 'couplesphotography']","11/3/18",2018-11-03 10:53:13,"2018"
"308",1859,"['smithrock']","11/3/18",2018-11-03 10:44:14,"2018"
"309",479,"['optoutside', 'mountaineering', 'rockclimbing', 'climbingphotography', 'liveclimbrepeat', 'tradisrad', 'adventure', 'climbing', 'outdoors', 'outdoorlife', 'climb', 'sky', 'mountainlife', 'aacgram', 'petzlgram', 'climbinglife', 'climbon', 'climber', 'adventuretime', 'climbingmag', 'climbing_pictures_of_instagram', 'alpinism', 'instagood', 'rei1440project', 'neverstopexploring', 'adventures', 'mountains', 'climbing_is_my_passion']","11/3/18",2018-11-02 19:09:04,"2018"
"310",424,"['optoutside', 'outdoor', 'climbingwalls', 'vibes', 'picoftheday', 'quotes', 'boricua', 'photoftheday', 'Sports', 'Oregon', 'Journey', 'Viajero', 'travelblogger', 'ClimbingTrip', 'outdoorsports', 'onestarindustries', 'livsn', 'climber', 'Climbing', 'islandboy', 'travel', 'Adventure', 'keepwhatmatters', 'Trip', 'IsabelinoEnElMundo', 'sportclimbing', 'Vive', 'wisely', 'goatworthy']","11/1/18",2018-11-01 14:34:21,"2018"
"311",486,"['scamplife365', 'yogawithfriends', 'friends', 'grateful', 'vanlife', 'practicingwithfriends', 'momlife']","10/31/18",2018-10-30 19:57:38,"2018"
"312",2273,"['shotbysalem']","10/31/18",2018-10-30 19:26:07,"2018"
"313",564,"['oregonelopementphotographer', 'weddingdayready', 'sedonaelopement', 'pnwphotographer', 'desertbride', 'bohobride', 'heyheyhellomay', 'loveelope', 'socalbride', 'travelingelopementphotographer', 'indiebride', 'hawaiielopementphotographer', 'kauaielopementphotographer', 'mauielopementphotographer', 'emilyvandeheyphotography', 'letselope', 'desertelopement', 'smithrockelopement', 'arizonaelopementphotographer', 'cultivate', 'freepeoplestories', 'bendelopementphotographer', 'bigsurelopementphotographer']","10/30/18",2018-10-30 12:52:14,"2018"
"314",569,"['oregonweddingphotographer', 'belovedstories', 'brideandtonic', 'authenticlovemag', 'shesaidyes', 'dirtybootsmessyhair', 'dirtybootsandmessyhair', 'pnwphotographer', 'authenticlove', 'radstorytellers', 'elopementcollective', 'littlethingstheory', 'bendphotographer', 'unconventionaltogs', 'adventurebride', 'muchlove_ig', 'justalittleloveinspo', 'elopement', 'wildelopements', 'radlovestories', 'wedventuremag', 'oregonengagementphotographer', 'loveandwildhearts', 'portlandweddingphotographer', 'adventurephotographer', 'thatsdarling']","10/30/18",2018-10-29 18:06:22,"2018"
"315",429,"['optoutside', 'outdoor', 'climbingwalls', 'vibes', 'climbingPR', 'boricua', 'photoftheday', 'Sports', 'Oregon', 'Journey', 'Viajero', 'travelblogger', 'ClimbingTrip', 'outdoorsports', 'onestarindustries', 'livsn', 'climber', 'Climbing', 'wallsaremeantforclimbing', 'islandboy', 'travel', 'Adventure', 'keepwhatmatters', 'Trip', 'IsabelinoEnElMundo', 'sportclimbing', 'Vive', 'wisely', 'goatworthy']","10/28/18",2018-10-28 13:08:26,"2018"
"316",374,"['iphonexsmax']","10/28/18",2018-10-27 18:00:44,"2018"
"317",2180,"['repeatoffender', 'prettydiesel', 'aggrogulley']","10/27/18",2018-10-27 14:57:41,"2018"
"318",822,"['awesomeearth', 'optoutside', 'hiking', 'yourclicks', 'love', 'visualsoflife', 'thatpnwlife', 'natureshots', 'pnw', 'outdoorlife', 'pnwroamers', 'nature', 'UpperLeftUSA', 'photographer', 'phonephotography', 'visionofpictures', 'photooftheday', 'wanderlust', 'justgoshoot', 'shutterbugs', 'beautiful', 'instagood', 'ig_nature', 'pnwonderland', 'adventurethatislife', 'pnwpride', 'beauty', 'bekind', 'pnwlife', 'pnwcollective']","10/27/18",2018-10-27 09:19:24,"2018"
"319",348,"['staywildish']","10/27/18",2018-10-27 06:51:42,"2018"
"320",478,"['optoutside', 'outdoor', 'climbingwalls', 'vibes', 'climbingPR', 'boricua', 'photoftheday', 'Sports', 'Oregon', 'Journey', 'travelblogger', 'ClimbingTrip', 'outdoorsports', 'onestarindustries', 'livsn', 'climber', 'Climbing', 'wallsaremeantforclimbing', 'islandboy', 'travel', 'Adventure', 'keepwhatmatters', 'Trip', 'IsabelinoEnElMundo', 'sportclimbing', 'Vive', 'US', 'wisely', 'goatworthy']","10/27/18",2018-10-27 06:17:44,"2018"
"321",1132,"['pacificnorthwest']","10/25/18",2018-10-25 11:50:12,"2018"
"322",383,"['whereyoubrew']","10/24/18",2018-10-24 16:15:18,"2018"
"323",617,"['tradisrad', 'climbinginspiration', 'climbing_is_my_passion', 'sportclimbing']","10/24/18",2018-10-24 11:00:23,"2018"
"324",435,"['timetoPARTY', 'wifey', 'samepeenforlife', 'IsaidFyeah', 'tripleC', 'engaged', 'smithrock']","10/24/18",2018-10-23 20:42:17,"2018"
"325",388,"['mother', 'thankyoutate', 'hisfeetaresobig', 'practice', 'lovewins']","10/23/18",2018-10-23 07:44:06,"2018"
"326",369,"['purepalm', 'lowergorge', 'womeninthemeadow', 'smithrock', 'northpoint']","10/22/18",2018-10-22 08:38:31,"2018"
"327",531,"['bendoregon', 'createcommune', 'smithrockstatepark', 'visitcentraloregon', 'wayfarecollective']","10/22/18",2018-10-22 08:05:10,"2018"
"328",1264,"['climbingisbliss', 'climbing', 'womenonlead', 'RcwAmbassador', 'climbingaddict', 'flashfoxy', 'climbgirls', 'climblikeagirl', 'girlonrockrockongirl', 'sendit', 'WaWomenCragClimbers', 'powerofshe', 'girlswhoclimb', 'womenempowerment', 'climbergirl', 'slaydies', 'rockclimbingwomen']","10/22/18",2018-10-22 07:34:45,"2018"
"329",376,"['smithrock15', 'FeedYourAdventure', 'optoutside', 'runhard', 'ultrarunning', 'hiking', 'ultrarunninglife', 'ultrarunner', 'pacnw', 'smithrock50k', 'sonya9', 'morningrun', 'run', 'trailrunner', 'running', 'sonyalpha', 'sonya7r3', 'trailrunning']","10/22/18",2018-10-22 06:08:03,"2018"
"330",2214,"['FeedYourAdventure', 'optoutside', 'runhard', 'ultrarunning', 'hiking', 'ultrarunninglife', 'ultrarunner', 'pacnw', 'sonya9', 'morningrun', 'run', 'trailrunner', 'running', 'sonyalpha', 'sonya7r3', 'trailrunning']","10/21/18",2018-10-21 14:44:09,"2018"
"331",495,"['grassland', 'rocks', 'happy', 'pnwphotographer', 'smithrock', 'rippedjeans', 'desert', 'indianajonesadventure', 'pdxphotographer', 'model', 'cliff', 'pdxmodel', 'warm', 'indianajoneshat', 'adventuretime', 'sun', 'sunny', 'oregon', 'content', 'beautiful', 'desertdays', 'desertshoot', 'goodday', 'pnwmodel', 'heels']","10/20/18",2018-10-20 12:02:15,"2018"
"332",1192,"['kenzelisadventures']","10/19/18",2018-10-18 18:29:03,"2018"
"333",523,"['oregonwedding', 'smithrockelopement', 'pnwelopement', 'bendoregonlife', 'bendoregon', 'smithrockwedding', 'weddingdress', 'smithrockstatepark', 'purusepretty', 'thatsdarling', 'smithrock']","10/18/18",2018-10-18 08:58:44,"2018"
"334",394,"['womenwhoclimb', 'tirmani', 'liveclimbrepeat', 'climbersunited', 'climbing_lovers', 'climbing', 'hypokpp', 'plywoodprincess', 'girlswhoclimb', 'climbmoja', 'digitalhumanbeans', 'aacgram', 'girlswhoclimbofficial', 'klettern', 'climbinglife', 'alpenglowco', 'strandedonland', 'somestoriesinspire', 'shestoopsyched', 'climbing_pictures_of_instagram', 'girlswithmuscle', 'girlswhocrush', 'getoutsidethegrind', 'girlsgoneroadie', 'climbing_is_my_passion', 'raregenes']","10/15/18",2018-10-15 12:24:12,"2018"
"335",403,"['almosthere']","10/15/18",2018-10-14 19:38:55,"2018"
"336",327,"['halloweentime', 'pnw', 'pumpkin', 'fallactivities', 'fallfashion', 'fallootd', 'autumn', 'becomingme', 'oregon', 'pumpkinpatch']","10/15/18",2018-10-14 18:33:28,"2018"
